Authors,Title,Year,Source title,Page start,Page end,Cited by
"Sayer, J.A., Otto, E.A., O'Toole, J.F., Nurnberg, G., Kennedy, M.A., Becker, C., Hennies, H.C., Helou, J., Attanasio, M., Fausett, B.V., Utsch, B., Khanna, H., Liu, Y., Drummond, I., Kawakami, I., Kusakabe, T., Tsuda, M., Ma, L., Lee, H., Larson, R.G., Allen, S.J., Wilkinson, C.J., Nigg, E.A., Shou, C., Lillo, C., Williams, D.S., Hoppe, B., Kemper, M.J., Neuhaus, T., Parisi, M.A., Glass, I.A., Petry, M., Kispert, A., Gloy, J., Ganner, A., Walz, G., Zhu, X., Goldman, D., Nurnberg, P., Swaroop, A., Leroux, M.R., Hildebrandt, F.",The centrosomal protein nephrocystin-6 is mutated in Joubert syndrome and activates transcription factor ATF4,2006,Nature Genetics,674,681,293
"Du, W., Bautista, J.F., Yang, H., Diez-Sampedro, A., You, S.-A., Wang, L., Kotagal, P., Lüders, H.O., Shi, J., Cui, J., Richerson, G.B., Wang, Q.K.",Calcium-sensitive potassium channelopathy in human epilepsy and paroxysmal movement disorder,2005,Nature Genetics,733,738,294
"Fisher, S.A., Tremelling, M., Anderson, C.A., Gwilliam, R., Bumpstead, S., Prescott, N.J., Nimmo, E.R., Massey, D., Berzuini, C., Johnson, C., Barrett, J.C., Cummings, F.R., Drummond, H., Lees, C.W., Onnie, C.M., Hanson, C.E., Blaszczyk, K., Inouye, M., Ewels, P., Ravindrarajah, R., Keniry, A., Hunt, S., Carter, M., Watkins, N., Ouwehand, W., Lewis, C.M., Cardon, L., Lobo, A., Forbes, A., Sanderson, J., Jewell, D.P., Mansfield, J.C., Deloukas, P., Mathew, C.G., Parkes, M., Satsangi, J.",Genetic determinants of ulcerative colitis include the ECM1 locus and five loci implicated in Crohn's disease,2008,Nature Genetics,710,712,294
"Illig, T., Gieger, C., Zhai, G., Römisch-Margl, W., Wang-Sattler, R., Prehn, C., Altmaier, E., Kastenmüller, G., Kato, B.S., Mewes, H.-W., Meitinger, T., De Angelis, M.H., Kronenberg, F., Soranzo, N., Wichmann, H.-E., Spector, T.D., Adamski, J., Suhre, K.",A genome-wide perspective of genetic variation in human metabolism,2010,Nature Genetics,137,141,294
"Fujimoto, A., Totoki, Y., Abe, T., Boroevich, K.A., Hosoda, F., Nguyen, H.H., Aoki, M., Hosono, N., Kubo, M., Miya, F., Arai, Y., Takahashi, H., Shirakihara, T., Nagasaki, M., Shibuya, T., Nakano, K., Watanabe-Makino, K., Tanaka, H., Nakamura, H., Kusuda, J., Ojima, H., Shimada, K., Okusaka, T., Ueno, M., Shigekawa, Y., Kawakami, Y., Arihiro, K., Ohdan, H., Gotoh, K., Ishikawa, O., Ariizumi, S.-I., Yamamoto, M., Yamada, T., Chayama, K., Kosuge, T., Yamaue, H., Kamatani, N., Miyano, S., Nakagama, H., Nakamura, Y., Tsunoda, T., Shibata, T., Nakagawa, H.",Whole-genome sequencing of liver cancers identifies etiological influences on mutation patterns and recurrent mutations in chromatin regulators,2012,Nature Genetics,760,764,295
"Topaz, O., Shurman, D.L., Bergman, R., Indelman, M., Ratajczak, P., Mizrachi, M., Khamaysi, Z., Behar, D., Petronius, D., Friedman, V., Zelikovic, I., Raimer, S., Metzker, A., Richard, G., Sprecher, E.","Mutations in GALNT3, encoding a protein involved in O-linked glycosylation, cause familial tumoral calcinosis",2004,Nature Genetics,579,581,296
"Barrett, J.C., Cardon, L.R.",Evaluating coverage of genome-wide association studies,2006,Nature Genetics,659,662,296
"Ule, J., Ule, A., Spencer, J., Williams, A., Hu, J.-S., Cline, M., Wang, H., Clark, T., Fraser, C., Ruggiu, M., Zeeberg, B.R., Kane, D., Weinstein, J.N., Blume, J., Darnell, R.B.",Nova regulates brain-specific splicing to shape the synapse,2005,Nature Genetics,844,852,297
"Hinkes, B., Wiggins, R.C., Gbadegesin, R., Vlangos, C.N., Seelow, D., Nürnberg, G., Garg, P., Verma, R., Chaib, H., Hoskins, B.E., Ashraf, S., Becker, C., Hennies, H.C., Goyal, M., Wharram, B.L., Schachter, A.D., Mudumana, S., Drummond, I., Kerjaschki, D., Waldherr, R., Dietrich, A., Ozaltin, F., Bakkaloglu, A., Cleper, R., Basel-Vanagaite, L., Pohl, M., Griebel, M., Tsygin, A.N., Soylu, A., Müller, D., Sorli, C.S., Bunney, T.D., Katan, M., Liu, J., Attanasio, M., O'Toole, J.F., Hasselbacher, K., Mucha, B., Otto, E.A., Airik, R., Kispert, A., Kelley, G.G., Smrcka, A.V., Gudermann, T., Holzman, L.B., Nürnberg, P., Hildebrandt, F.",Positional cloning uncovers mutations in PLCE1 responsible for a nephrotic syndrome variant that may be reversible,2006,Nature Genetics,1397,1405,298
"Tuupanen, S., Turunen, M., Lehtonen, R., Hallikas, O., Vanharanta, S., Kivioja, T., Björklund, M., Wei, G., Yan, J., Niittymäki, I., Mecklin, J.-P., Järvinen, H., Ristimäki, A., Di-Bernardo, M., East, P., Carvajal-Carmona, L., Houlston, R.S., Tomlinson, I., Palin, K., Ukkonen, E., Karhu, A., Taipale, J., Aaltonen, L.A.",The common colorectal cancer predisposition SNP rs6983267 at chromosome 8q24 confers potential to enhanced Wnt signaling,2009,Nature Genetics,885,890,298
"García-Cao, M., O'Sullivan, R., Peters, A.H.F.M., Jenuwein, T., Blasco, M.A.",Epigenetic regulation of telomere length in mammalian cells by the Suv39h1 and Suv39h2 histone methyltransferases,2004,Nature Genetics,94,99,299
"Rosenbauer, F., Wagner, K., Kutok, J.L., Iwasaki, H., Le Beau, M.M., Okuno, Y., Akashi, K., Fiering, S., Tenen, D.G.","Acute myeloid leukemia induced by graded reduction of a lineage-specific transcription factor, PU.1",2004,Nature Genetics,624,630,299
"Brunetti-Pierri, N., Berg, J.S., Scaglia, F., Belmont, J., Bacino, C.A., Sahoo, T., Lalani, S.R., Graham, B., Lee, B., Shinawi, M., Shen, J., Kang, S.-H.L., Pursley, A., Lotze, T., Kennedy, G., Lansky-Shafer, S., Weaver, C., Roeder, E.R., Grebe, T.A., Arnold, G.L., Hutchison, T., Reimschisel, T., Amato, S., Geragthy, M.T., Innis, J.W., Obersztyn, E., Nowakowska, B., Rosengren, S.S., Bader, P.I., Grange, D.K., Naqvi, S., Garnica, A.D., Bernes, S.M., Fong, C.-T., Summers, A., Walters, W.D., Lupski, J.R., Stankiewicz, P., Cheung, S.W., Patel, A.",Recurrent reciprocal 1q21.1 deletions and duplications associated with microcephaly or macrocephaly and developmental and behavioral abnormalities,2008,Nature Genetics,1466,1471,299
"Tarpey, P.S., Smith, R., Pleasance, E., Whibley, A., Edkins, S., Hardy, C., O'Meara, S., Latimer, C., Dicks, E., Menzies, A., Stephens, P., Blow, M., Greenman, C., Xue, Y., Tyler-Smith, C., Thompson, D., Gray, K., Andrews, J., Barthorpe, S., Buck, G., Cole, J., Dunmore, R., Jones, D., Maddison, M., Mironenko, T., Turner, R., Turrell, K., Varian, J., West, S., Widaa, S., Wray, P., Teague, J., Butler, A., Jenkinson, A., Jia, M., Richardson, D., Shepherd, R., Wooster, R., Tejada, M.I., Martinez, F., Carvill, G., Goliath, R., De Brouwer, A.P.M., Van Bokhoven, H., Van Esch, H., Chelly, J., Raynaud, M., Ropers, H.-H., Abidi, F.E., Srivastava, A.K., Cox, J., Luo, Y., Mallya, U., Moon, J., Parnau, J., Mohammed, S., Tolmie, J.L., Shoubridge, C., Corbett, M., Gardner, A., Haan, E., Rujirabanjerd, S., Shaw, M., Vandeleur, L., Fullston, T., Easton, D.F., Boyle, J., Partington, M., Hackett, A., Field, M., Skinner, C., Stevenson, R.E., Bobrow, M., Turner, G., Schwartz, C.E., Gecz, J., Raymond, F.L., Futreal, P.A., Stratton, M.R.","A systematic, large-scale resequencing screen of X-chromosome coding exons in mental retardation",2009,Nature Genetics,535,543,299
"Liu, J.Z., Tozzi, F., Waterworth, D.M., Pillai, S.G., Muglia, P., Middleton, L., Berrettini, W., Knouff, C.W., Yuan, X., Waeber, G., Vollenweider, P., Preisig, M., Wareham, N.J., Zhao, J.H., Loos, R.J.F., Barroso, I., Khaw, K.-T., Grundy, S., Barter, P., Mahley, R., Kesaniemi, A., McPherson, R., Vincent, J.B., Strauss, J., Kennedy, J.L., Farmer, A., McGuffin, P., Day, R., Matthews, K., Bakke, P., Gulsvik, A., Lucae, S., Ising, M., Brueckl, T., Horstmann, S., Wichmann, H.-E., Rawal, R., Dahmen, N., Lamina, C., Polasek, O., Zgaga, L., Huffman, J., Campbell, S., Kooner, J., Chambers, J.C., Burnett, M.S., Devaney, J.M., Pichard, A.D., Kent, K.M., Satler, L., Lindsay, J.M., Waksman, R., Epstein, S., Wilson, J.F., Wild, S.H., Campbell, H., Vitart, V., Reilly, M.P., Li, M., Qu, L., Wilensky, R., Matthai, W., Hakonarson, H.H., Rader, D.J., Franke, A., Wittig, M., Schäfer, A., Uda, M., Terracciano, A., Xiao, X., Busonero, F., Scheet, P., Schlessinger, D., Clair, D.S., Rujescu, D., Abecasis, G.R., Grabe, H.J., Teumer, A., Völzke, H., Petersmann, A., John, U., Rudan, I., Hayward, C., Wright, A.F., Kolcic, I., Wright, B.J., Thompson, J.R., Balmforth, A.J., Hall, A.S., Samani, N.J., Anderson, C.A., Ahmad, T., Mathew, C.G., Parkes, M., Satsangi, J., Caulfield, M., Munroe, P.B., Farrall, M., Dominiczak, A., Worthington, J., Thomson, W., Eyre, S., Barton, A., Mooser, V., Francks, C., Marchini, J.",Meta-analysis and imputation refines the association of 15q25 with smoking quantity,2010,Nature Genetics,436,440,299
"Teichmann, S.A., Babu, M.M.",Gene regulatory network growth by duplication,2004,Nature Genetics,492,496,300
"Sweet-Cordero, A., Mukherjee, S., Subramanian, A., You, H., Roix, J.J., Ladd-Acosta, C., Mesirov, J., Golub, T.R., Jacks, T.",An oncogenic KRAS2 expression signature identified by cross-species gene-expression analysis,2005,Nature Genetics,48,55,300
"Zhang, Z., Lee, J.C., Lin, L., Olivas, V., Au, V., Laframboise, T., Abdel-Rahman, M., Wang, X., Levine, A.D., Rho, J.K., Choi, Y.J., Choi, C.-M., Kim, S.-W., Jang, S.J., Park, Y.S., Kim, W.S., Lee, D.H., Lee, J.-S., Miller, V.A., Arcila, M., Ladanyi, M., Moonsamy, P., Sawyers, C., Boggon, T.J., Ma, P.C., Costa, C., Taron, M., Rosell, R., Halmos, B., Bivona, T.G.",Activation of the AXL kinase causes resistance to EGFR-targeted therapy in lung cancer,2012,Nature Genetics,852,860,300
"Lorenz-Depiereux, B., Bastepe, M., Benet-Pagès, A., Amyere, M., Wagenstaller, J., Müller-Barth, U., Badenhoop, K., Kaiser, S.M., Rittmaster, R.S., Shlossberg, A.H., Olivares, J.L., Loris, C., Ramos, F.J., Glorieux, F., Vikkula, M., Jüppner, H., Strom, T.M.",DMP1 mutations in autosomal recessive hypophosphatemia implicate a bone matrix protein in the regulation of phosphate homeostasis,2006,Nature Genetics,1248,1250,301
"Saxena, R., Hivert, M.-F., Langenberg, C., Tanaka, T., Pankow, J.S., Vollenweider, P., Lyssenko, V., Bouatia-Naji, N., Dupuis, J., Jackson, A.U., Kao, W.H.L., Li, M., Glazer, N.L., Manning, A.K., Anluan, J., Stringham, H.M., Prokopenko, I., Johnson, T., Grarup, N., Boesgaard, T.W., Lecoeur, C., Shrader, P., Oconnell, J., Ingelsson, E., Couper, D.J., Rice, K., Song, K., Andreasen, C.H., Dina, C., KöTTGEN, A., Bacquer, O.L., Pattou, F., Taneera, J., Steinthorsdottir, V., Rybin, D., Ardlie, K., Sampson, M., Qi, L., Hoek, M.V., Weedon, M.N., Aulchenko, Y.S., Voight, B.F., Grallert, H., Balkau, B., Bergman, R.N., Bielinski, S.J., Bonnefond, A., Bonnycastle, L.L., Borch-Johnsen, K., BöTTCHER, Y., Brunner, E., Buchanan, T.A., Bumpstead, S.J., Cavalcanti-Proença, C., Charpentier, G., Chen, Y.-D.I., Chines, P.S., Collins, F.S., Cornelis, M., Crawford, G.J., Delplanque, J., Doney, A., Egan, J.M., Erdos, M.R., Firmann, M., Forouhi, N.G., Fox, C.S., Goodarzi, M.O., Graessler, J., Hingorani, A., Isomaa, B., Jørgensen, T., Kivimaki, M., Kovacs, P., Krohn, K., Kumari, M., Lauritzen, T., Lévy-Marchal, C., Mayor, V., McAteer, J.B., Meyre, D., Mitchell, B.D., Mohlke, K.L., Morken, M.A., Narisu, N., Apalmer, C.N., Pakyz, R., Pascoe, L., Payne, F., Pearson, D., Rathmann, W., Sandbaek, A., Sayer, A.A., Scott, L.J., Sharp, S.J., Sijbrands, E., Singleton, A., Siscovick, D.S., Smith, N.L., Sparsø, T., Swift, A.J., Syddall, H., Thorleifsson, G., TöNJES, A., Tuomi, T., Tuomilehto, J., Valle, T.T., Waeber, G., Walley, A., Waterworth, D.M., Zeggini, E., Zhao, J.H., Consortium, G., Illig, T., Wichmann, H.E., Wilson, J.F., Duijn, C.V., Hu, F.B., Morris, A.D., Frayling, T.M., Hattersley, A.T., Thorsteinsdottir, U., Stefansson, K., Nilsson, P., Syvänen, A.-C., Shuldiner, A.R., Walker, M., Bornstein, S.R., Schwarz, P., Williams, G.H., Nathan, D.M., Kuusisto, J., Laakso, M., Cooper, C., Marmot, M., Ferrucci, L., Mooser, V., Stumvoll, M., Loos, R.J.F., Altshuler, D., Psaty, B.M., Rotter, J.I., Boerwinkle, E., Hansen, T., Pedersen, O., Florez, J.C., McCarthy, M.I., Boehnke, M., Barroso, I., Sladek, R., Froguel, P., Meigs, J.B., Groop, L., Wareham, N.J., Watanabe, R.M.",Genetic variation in GIPR influences the glucose and insulin responses to an oral glucose challenge,2010,Nature Genetics,142,148,301
"Bourdon, A., Minai, L., Serre, V., Jais, J.-P., Sarzi, E., Aubert, S., Chrétien, D., De Lonlay, P., Paquis-Flucklinger, V., Arakawa, H., Nakamura, Y., Munnich, A., Rötig, A.","Mutation of RRM2B, encoding p53-controlled ribonucleotide reductase (p53R2), causes severe mitochondrial DNA depletion",2007,Nature Genetics,776,780,302
"Ahmed, S., Thomas, G., Ghoussaini, M., Healey, C.S., Humphreys, M.K., Platte, R., Morrison, J., Maranian, M., Pooley, K.A., Luben, R., Eccles, D., Evans, D.G., Fletcher, O., Johnson, N., Dos Santos Silva, I., Peto, J., Stratton, M.R., Rahman, N., Jacobs, K., Prentice, R., Anderson, G.L., Rajkovic, A., Curb, J.D., Ziegler, R.G., Berg, C.D., Buys, S.S., McCarty, C.A., Feigelson, H.S., Calle, E.E., Thun, M.J., Diver, W.R., Bojesen, S., Nordestgaard, B.G., Flyger, H., Dörk, T., Schürmann, P., Hillemanns, P., Karstens, J.H., Bogdanova, N.V., Antonenkova, N.N., Zalutsky, I.V., Bermisheva, M., Fedorova, S., Khusnutdinova, E., Kang, D., Yoo, K.-Y., Noh, D.Y., Ahn, S.-H., Devilee, P., Van Asperen, C.J., Tollenaar, R.A.E.M., Seynaeve, C., Garcia-Closas, M., Lissowska, J., Brinton, L., Peplonska, B., Nevanlinna, H., Heikkinen, T., Aittomäki, K., Blomqvist, C., Hopper, J.L., Southey, M.C., Smith, L., Spurdle, A.B., Schmidt, M.K., Broeks, A., Van Hien, R.R., Cornelissen, S., Milne, R.L., Ribas, G., González-Neira, A., Benitez, J., Schmutzler, R.K., Burwinkel, B., Bartram, C.R., Meindl, A., Brauch, H., Justenhoven, C., Hamann, U., Chang-Claude, J., Hein, R., Wang-Gohrke, S., Lindblom, A., Margolin, S., Mannermaa, A., Kosma, V.-M., Kataja, V., Olson, J.E., Wang, X., Fredericksen, Z., Giles, G.G., Severi, G., Baglietto, L., English, D.R., Hankinson, S.E., Cox, D.G., Kraft, P., Vatten, L.J., Hveem, K., Kumle, M., Sigurdson, A., Doody, M., Bhatti, P., Alexander, B.H., Hooning, M.J., Van Den Ouweland, A.M.W., Oldenburg, R.A., Schutte, M., Hall, P., Czene, K., Liu, J., Li, Y., Cox, A., Elliott, G., Brock, I., Reed, M.W.R., Shen, C.-Y., Yu, J.-C., Hsu, G.-C., Chen, S.-T., Anton-Culver, H., Ziogas, A., Andrulis, I.L., Knight, J.A., Beesley, J., Goode, E.L., Couch, F., Chenevix-Trench, G., Hoover, R.N., Ponder, B.A.J., Hunter, D.J., Pharoah, P.D.P., Dunning, A.M., Chanock, S.J., Easton, D.F.",Newly discovered breast cancer susceptibility loci on 3p24 and 17q23.2,2009,Nature Genetics,585,590,302
"Mátés, L., Chuah, M.K.L., Belay, E., Jerchow, B., Manoj, N., Acosta-Sanchez, A., Grzela, D.P., Schmitt, A., Becker, K., Matrai, J., Ma, L., Samara-Kuko, E., Gysemans, C., Pryputniewicz, D., Miskey, C., Fletcher, B., Vandendriessche, T., Ivics, Z., Izsvák, Z.",Molecular evolution of a novel hyperactive Sleeping Beauty transposase enables robust stable gene transfer in vertebrates,2009,Nature Genetics,753,761,302
"Lewis, A., Mitsuya, K., Umlauf, D., Smith, P., Dean, W., Walter, J., Higgins, M., Feil, R., Reik, W.",Imprinting on distal chromosome 7 in the placenta involves repressive histone methylation independent of DNA methylation,2004,Nature Genetics,1291,1295,303
"Friesen, T.L., Stukenbrock, E.H., Liu, Z., Meinhardt, S., Ling, H., Faris, J.D., Rasmussen, J.B., Solomon, P.S., McDonald, B.A., Oliver, R.P.",Emergence of a new disease as a result of interspecific virulence gene transfer,2006,Nature Genetics,953,956,303
"Li, P., Ponnala, L., Gandotra, N., Wang, L., Si, Y., Tausta, S.L., Kebrom, T.H., Provart, N., Patel, R., Myers, C.R., Reidel, E.J., Turgeon, R., Liu, P., Sun, Q., Nelson, T., Brutnell, T.P.",The developmental dynamics of the maize leaf transcriptome,2010,Nature Genetics,1060,1067,303
"Obad, S., Dos Santos, C.O., Petri, A., Heidenblad, M., Broom, O., Ruse, C., Fu, C., Lindow, M., Stenvang, J., Straarup, E.M., Hansen, H.F., Koch, T., Pappin, D., Hannon, G.J., Kauppinen, S.",Silencing of microRNA families by seed-targeting tiny LNAs,2011,Nature Genetics,371,380,303
"Wang, H.-W., Trotter, M.W.B., Lagos, D., Bourboulia, D., Henderson, S., Mäkinen, T., Elliman, S., Flanagan, A.M., Alitalo, K., Boshoff, C.",Kaposi sarcoma herpesvirus-induced cellular reprogramming contributes to the lymphatic endothelial gene expression in Kaposi sarcoma,2004,Nature Genetics,687,693,304
"Gicquel, C., Rossignol, S., Cabrol, S., Houang, M., Steunou, V., Barbu, V., Danton, F., Thibaud, N., Le Merrer, M., Burglen, L., Bertrand, A.-M., Netchine, I., Le Bouc, Y.",Epimutation of the telomeric imprinting center region on chromosome 11p15 in Silver-Russell syndrome,2005,Nature Genetics,1003,1007,304
"Michailidou, K., Hall, P., Gonzalez-Neira, A., Ghoussaini, M., Dennis, J., Milne, R.L., Schmidt, M.K., Chang-Claude, J., Bojesen, S.E., Bolla, M.K., Wang, Q., Dicks, E., Lee, A., Turnbull, C., Rahman, N., Fletcher, O., Peto, J., Gibson, L., Dos Santos Silva, I., Nevanlinna, H., Muranen, T.A., Aittomäki, K., Blomqvist, C., Czene, K., Irwanto, A., Liu, J., Waisfisz, Q., Meijers-Heijboer, H., Adank, M., Van Der Luijt, R.B., Hein, R., Dahmen, N., Beckman, L., Meindl, A., Schmutzler, R.K., Müller-Myhsok, B., Lichtner, P., Hopper, J.L., Southey, M.C., Makalic, E., Schmidt, D.F., Uitterlinden, A.G., Hofman, A., Hunter, D.J., Chanock, S.J., Vincent, D., Bacot, F., Tessier, D.C., Canisius, S., Wessels, L.F.A., Haiman, C.A., Shah, M., Luben, R., Brown, J., Luccarini, C., Schoof, N., Humphreys, K., Li, J., Nordestgaard, Bø.G., Nielsen, S.F., Flyger, H., Couch, F.J., Wang, X., Vachon, C., Stevens, K.N., Lambrechts, D., Moisse, M., Paridaens, R., Christiaens, M.-R., Rudolph, A., Nickels, S., Flesch-Janys, D., Johnson, N., Aitken, Z., Aaltonen, K., Heikkinen, T., Broeks, A., Veer, L.J.V., Van Der Schoot, C.E., Guénel, P., Truong, T., Laurent-Puig, P., Menegaux, F., Marme, F., Schneeweiss, A., Sohn, C., Burwinkel, B., Zamora, M.P., Perez, J.I.A., Pita, G., Alonso, M.R., Cox, A., Brock, I.W., Cross, S.S., Reed, M.W.R., Sawyer, E.J., Tomlinson, I., Kerin, M.J., Miller, N., Henderson, B.E., Schumacher, F., Le Marchand, L., Andrulis, I.L., Knight, J.A., Glendon, G., Mulligan, A.M., Lindblom, A., Margolin, S., Hooning, M.J., Hollestelle, A., Van Den Ouweland, A.M.W., Jager, A., Bui, Q.M., Stone, J., Dite, G.S., Apicella, C., Tsimiklis, H., Giles, G.G., Severi, G., Baglietto, L., Fasching, P.A., Haeberle, L., Ekici, A.B., Beckmann, M.W., Brenner, H., Müller, H., Arndt, V., Stegmaier, C., Swerdlow, A., Ashworth, A., Orr, N., Jones, M., Figueroa, J., Lissowska, J., Brinton, L., Goldberg, M.S., Labrèche, F., Dumont, M., Winqvist, R., Pylkäs, K., Jukkola-Vuorinen, A., Grip, M., Brauch, H., Hamann, U., Brüning, T., Radice, P., Peterlongo, P., Manoukian, S., Bonanni, B., Devilee, P., Tollenaar, R.A.E.M., Seynaeve, C., Van Asperen, C.J., Jakubowska, A., Lubinski, J., Jaworska, K., Durda, K., Mannermaa, A., Kataja, V., Kosma, V.-M., Hartikainen, J.M., Bogdanova, N.V., Antonenkova, N.N., Dörk, T., Kristensen, V.N., Anton-Culver, H., Slager, S., Toland, A.E., Edge, S., Fostira, F., Kang, D., Yoo, K.-Y., Noh, D.-Y., Matsuo, K., Ito, H., Iwata, H., Sueta, A., Wu, A.H., Tseng, C.-C., Van Den Berg, D., Stram, D.O., Shu, X.-O., Lu, W., Gao, Y.-T., Cai, H., Teo, S.H., Yip, C.H., Phuah, S.Y., Cornes, B.K., Hartman, M., Miao, H., Lim, W.Y., Sng, J.-H., Muir, K., Lophatananon, A., Stewart-Brown, S., Siriwanarangsan, P., Shen, C.-Y., Hsiung, C.-N., Wu, P.-E., Ding, S.-L., Sangrajrang, S., Gaborieau, V., Brennan, P., McKay, J., Blot, W.J., Signorello, L.B., Cai, Q., Zheng, W., Deming-Halverson, S., Shrubsole, M., Long, J., Simard, J., Garcia-Closas, M., Pharoah, P.D.P., Chenevix-Trench, G., Dunning, A.M., Benitez, J., Easton, D.F.",Large-scale genotyping identifies 41 new loci associated with breast cancer risk,2013,Nature Genetics,353,361,304
"Prokunina-Olsson, L., Muchmore, B., Tang, W., Pfeiffer, R.M., Park, H., Dickensheets, H., Hergott, D., Porter-Gill, P., Mumy, A., Kohaar, I., Chen, S., Brand, N., Tarway, M., Liu, L., Sheikh, F., Astemborski, J., Bonkovsky, H.L., Edlin, B.R., Howell, C.D., Morgan, T.R., Thomas, D.L., Rehermann, B., Donnelly, R.P., O'Brien, T.R.",A variant upstream of IFNL3 (IL28B) creating a new interferon gene IFNL4 is associated with impaired clearance of hepatitis C virus,2013,Nature Genetics,164,171,305
"Fanciulli, M., Norsworthy, P.J., Petretto, E., Dong, R., Harper, L., Kamesh, L., Heward, J.M., Gough, S.C.L., De Smith, A., Blakemore, A.I.F., Froguel, P., Owen, C.J., Pearce, S.H.S., Teixeira, L., Guillevin, L., Graham, D.S.C., Pusey, C.D., Cook, H.T., Vyse, T.J., Aitman, T.J.","FCGR3B copy number variation is associated with susceptibility to systemic, but not organ-specific, autoimmunity",2007,Nature Genetics,721,723,306
"Lee-Kirsch, M.A., Gong, M., Chowdhury, D., Senenko, L., Engel, K., Lee, Y.-A., De Silva, U., Bailey, S.L., Witte, T., Vyse, T.J., Kere, J., Pfeiffer, C., Harvey, S., Wong, A., Koskenmies, S., Hummel, O., Rohde, K., Schmidt, R.E., Dominiczak, A.F., Gahr, M., Hollis, T., Perrino, F.W., Lieberman, J., Hübner, N.",Mutations in the gene encoding the 3′-5′ DNA exonuclease TREX1 are associated with systemic lupus erythematosus,2007,Nature Genetics,1065,1067,306
"Gui, Y., Guo, G., Huang, Y., Hu, X., Tang, A., Gao, S., Wu, R., Chen, C., Li, X., Zhou, L., He, M., Li, Z., Sun, X., Jia, W., Chen, J., Yang, S., Zhou, F., Zhao, X., Wan, S., Ye, R., Liang, C., Liu, Z., Huang, P., Liu, C., Jiang, H., Wang, Y., Zheng, H., Sun, L., Liu, X., Jiang, Z., Feng, D., Chen, J., Wu, S., Zou, J., Zhang, Z., Yang, R., Zhao, J., Xu, C., Yin, W., Guan, Z., Ye, J., Zhang, H., Li, J., Kristiansen, K., Nickerson, M.L., Theodorescu, D., Li, Y., Zhang, X., Li, S., Wang, J., Yang, H., Wang, J., Cai, Z.",Frequent mutations of chromatin remodeling genes in transitional cell carcinoma of the bladder,2011,Nature Genetics,875,878,306
"Estrada, K., Styrkarsdottir, U., Evangelou, E., Hsu, Y.-H., Duncan, E.L., Ntzani, E.E., Oei, L., Albagha, O.M.E., Amin, N., Kemp, J.P., Koller, D.L., Li, G., Liu, C.-T., Minster, R.L., Moayyeri, A., Vandenput, L., Willner, D., Xiao, S.-M., Yerges-Armstrong, L.M., Zheng, H.-F., Alonso, N., Eriksson, J., Kammerer, C.M., Kaptoge, S.K., Leo, P.J., Thorleifsson, G., Wilson, S.G., Wilson, J.F., Aalto, V., Alen, M., Aragaki, A.K., Aspelund, T., Center, J.R., Dailiana, Z., Duggan, D.J., Garcia, M., Garcia-Giralt, N., Giroux, S., Hallmans, G., Hocking, L.J., Husted, L.B., Jameson, K.A., Khusainova, R., Kim, G.S., Kooperberg, C., Koromila, T., Kruk, M., Laaksonen, M., Lacroix, A.Z., Lee, S.H., Leung, P.C., Lewis, J.R., Masi, L., Mencej-Bedrac, S., Nguyen, T.V., Nogues, X., Patel, M.S., Prezelj, J., Rose, L.M., Scollen, S., Siggeirsdottir, K., Smith, A.V., Svensson, O., Trompet, S., Trummer, O., Van Schoor, N.M., Woo, J., Zhu, K., Balcells, S., Brandi, M.L., Buckley, B.M., Cheng, S., Christiansen, C., Cooper, C., Dedoussis, G., Ford, I., Frost, M., Goltzman, D., González-Macías, J., Kähönen, M., Karlsson, M., Khusnutdinova, E., Koh, J.-M., Kollia, P., Langdahl, B.L., Leslie, W.D., Lips, P., Ljunggren, O., Lorenc, R.S., Marc, J., Mellström, D., Obermayer-Pietsch, B., Olmos, J.M., Pettersson-Kymmer, U., Reid, D.M., Riancho, J.A., Ridker, P.M., Rousseau, F., Lagboom, P.E.S., Tang, N.L.S., Urreizti, R., Van Hul, W., Viikari, J., Zarrabeitia, M.T., Aulchenko, Y.S., Castano-Betancourt, M., Grundberg, E., Herrera, L., Ingvarsson, T., Johannsdottir, H., Kwan, T., Li, R., Luben, R., Medina-Gómez, C., Th Palsson, S., Reppe, S., Rotter, J.I., Sigurdsson, G., Van Meurs, J.B.J., Verlaan, D., Williams, F.M.K., Wood, A.R., Zhou, Y., Gautvik, K.M., Pastinen, T., Raychaudhuri, S., Cauley, J.A., Chasman, D.I., Clark, G.R., Cummings, S.R., Danoy, P., Dennison, E.M., Eastell, R., Eisman, J.A., Gudnason, V., Hofman, A., Jackson, R.D., Jones, G., Jukema, J.W., Khaw, K.-T., Lehtimäki, T., Liu, Y., Lorentzon, M., Mccloskey, E., Mitchell, B.D., Nandakumar, K., Nicholson, G.C., Oostra, B.A., Peacock, M., Pols, H.A.P., Prince, R.L., Raitakari, O., Reid, I.R., Robbins, J., Sambrook, P.N., Sham, P.C., Shuldiner, A.R., Tylavsky, F.A., Van Duijn, C.M., Wareham, N.J., Cupples, L.A., Econs, M.J., Evans, D.M., Harris, T.B., Kung, A.W.C., Psaty, B.M., Reeve, J., Spector, T.D., Streeten, E.A., Zillikens, M.C., Thorsteinsdottir, U., Ohlsson, C., Karasik, D., Richards, J.B., Brown, M.A., Stefansson, K., Uitterlinden, A.G., Ralston, S.H., Ioannidis, J.P.A., Kiel, D.P., Rivadeneira, F.",Genome-wide meta-analysis identifies 56 bone mineral density loci and reveals 14 loci associated with risk of fracture,2012,Nature Genetics,491,501,306
"Hu, M., Yao, J., Cai, L., Bachman, K.E., Van Den Brûle, F., Velculescu, V., Polyak, K.",Distinct epigenetic changes in the stromal cells of breast cancers,2005,Nature Genetics,899,905,307
"Turner, J.M.A., Mahadevaiah, S.K., Fernandez-Capetillo, O., Nussenzweig, A., Xu, X., Deng, C.-X., Burgoyne, P.S.",Silencing of unsynapsed meiotic chromosomes in the mouse,2005,Nature Genetics,41,47,307
"Verstrepen, K.J., Jansen, A., Lewitter, F., Fink, G.R.",Intragenic tandem repeats generate functional variability,2005,Nature Genetics,986,990,307
"Ripperger, J.A., Schibler, U.",Rhythmic CLOCK-BMAL1 binding to multiple E-box motifs drives circadian Dbp transcription and chromatin transitions,2006,Nature Genetics,369,374,307
