Authors,Title,Year,Source title,Page start,Page end,Cited by
"Artigas, M.S., Loth, D.W., Wain, L.V., Gharib, S.A., Obeidat, M., Tang, W., Zhai, G., Zhao, J.H., Smith, A.V., Huffman, J.E., Albrecht, E., Jackson, C.M., Evans, D.M., Cadby, G., Fornage, M., Manichaikul, A., Lopez, L.M., Johnson, T., Aldrich, M.C., Aspelund, T., Barroso, I., Campbell, H., Cassano, P.A., Couper, D.J., Eiriksdottir, G., Franceschini, N., Garcia, M., Gieger, C., Gislason, G.K., Grkovic, I., Hammond, C.J., Hancock, D.B., Harris, T.B., Ramasamy, A., Heckbert, S.R., Heliövaara, M., Homuth, G., Hysi, P.G., James, A.L., Jankovic, S., Joubert, B.R., Karrasch, S., Klopp, N., Koch, B., Kritchevsky, S.B., Launer, L.J., Liu, Y., Loehr, L.R., Lohman, K., Loos, R.J.F., Lumley, T., Al Balushi, K.A., Ang, W.Q., Barr, R.G., Beilby, J., Blakey, J.D., Boban, M., Boraska, V., Brisman, J., Britton, J.R., Brusselle, G.G., Cooper, C., Curjuric, I., Dahgam, S., Deary, I.J., Ebrahim, S., Eijgelsheim, M., Francks, C., Gaysina, D., Granell, R., Gu, X., Hankinson, J.L., Hardy, R., Harris, S.E., Henderson, J., Henry, A., Hingorani, A.D., Hofman, A., Holt, P.G., Hui, J., Hunter, M.L., Imboden, M., Jameson, K.A., Kerr, S.M., Kolcic, I., Kronenberg, F., Liu, J.Z., Marchini, J., McKeever, T., Morris, A.D., Olin, A.-C., Porteous, D.J., Postma, D.S., Rich, S.S., Ring, S.M., Rivadeneira, F., Rochat, T., Sayer, A.A., Sayers, I., Sly, P.D., Smith, G.D., Sood, A., Starr, J.M., Uitterlinden, A.G., Vonk, J.M., Wannamethee, S.G., Whincup, P.H., Wijmenga, C., Williams, O.D., Wong, A., Mangino, M., Marciante, K.D., McArdle, W.L., Meibohm, B., Morrison, A.C., North, K.E., Omenaas, E., Palmer, L.J., Pietiläinen, K.H., Pin, I., Polašek, O., Pouta, A., Psaty, B.M., Hartikainen, A.-L., Rantanen, T., Ripatti, S., Rotter, J.I., Rudan, I., Rudnicka, A.R., Schulz, H., Shin, S.-Y., Spector, T.D., Surakka, I., Vitart, V., Völzke, H., Wareham, N.J., Warrington, N.M., Wichmann, H.-E., Wild, S.H., Wilk, J.B., Wjst, M., Wright, A.F., Zgaga, L., Zemunik, T., Pennell, C.E., Nyberg, F., Kuh, D., Holloway, J.W., Boezen, H.M., Lawlor, D.A., Morris, R.W., Probst-Hensch, N., Kaprio, J., Wilson, J.F., Hayward, C., Kähönen, M., Heinrich, J., Musk, A.W., Jarvis, D.L., Gläser, S., Järvelin, M.-R., Ch Stricker, B.H., Elliott, P., O'Connor, G.T., Strachan, D.P., London, S.J., Hall, I.P., Gudnason, V., Tobin, M.D.",Genome-wide association and large-scale follow up identifies 16 new loci influencing lung function,2011,Nature Genetics,1082,1090,153
"Nowack, M.K., Grini, P.E., Jakoby, M.J., Lafos, M., Koncz, C., Schnittger, A.",A positive signal from the fertilization of the egg cell sets off endosperm proliferation in angiosperm embryogenesis,2006,Nature Genetics,63,67,154
"Repping, S., Van Daalen, S.K.M., Brown, L.G., Korver, C.M., Lange, J., Marszalek, J.D., Pyntikova, T., Van Der Veen, F., Skaletsky, H., Page, D.C., Rozen, S.",High mutation rates have driven extensive structural polymorphism among human Y chromosomes,2006,Nature Genetics,463,467,154
"Tran, P.V., Haycraft, C.J., Besschetnova, T.Y., Turbe-Doan, A., Stottmann, R.W., Herron, B.J., Chesebro, A.L., Qiu, H., Scherz, P.J., Shah, J.V., Yoder, B.K., Beier, D.R.",THM1 negatively modulates mouse sonic hedgehog signal transduction and affects retrograde intraflagellar transport in cilia,2008,Nature Genetics,403,410,154
"Lewis, M.A., Quint, E., Glazier, A.M., Fuchs, H., De Angelis, M.H., Langford, C., Van Dongen, S., Abreu-Goodger, C., Piipari, M., Redshaw, N., Dalmay, T., Moreno-Pelayo, M.A., Enright, A.J., Steel, K.P.",An ENU-induced mutation of miR-96 associated with progressive hearing loss in mice,2009,Nature Genetics,614,618,154
"Burdon, K.P., MacGregor, S., Hewitt, A.W., Sharma, S., Chidlow, G., Mills, R.A., Danoy, P., Casson, R., Viswanathan, A.C., Liu, J.Z., Landers, J., Henders, A.K., Wood, J., Souzeau, E., Crawford, A., Leo, P., Wang, J.J., Rochtchina, E., Nyholt, D.R., Martin, N.G., Montgomery, G.W., Mitchell, P., Brown, M.A., MacKey, D.A., Craig, J.E.",Genome-wide association study identifies susceptibility loci for open angle glaucoma at TMCO1 and CDKN2B-AS1,2011,Nature Genetics,574,578,154
"Bellenguez, C., Bevan, S., Gschwendtner, A., Spencer, C.C.A., Burgess, A.I., Pirinen, M., Jackson, C.A., Traylor, M., Strange, A., Su, Z., Band, G., Syme, P.D., Malik, R., Pera, J., Bo, N., Lemmens, R., Freeman, C., Schanz, R., James, T., Poole, D., Murphy, L., Segal, H., Cortellini, L., Cheng, Y.-C., Woo, D., Nalls, M.A., Müller-Myhsok, B., Meisinger, C., Seedorf, U., Ross-Adams, H., Boonen, S., Wloch-Kopec, D., Valant, V., Slark, J., Furie, K., Delavaran, H., Langford, C., Deloukas, P., Edkins, S., Hunt, S., Gray, E., Dronov, S., Peltonen, L., Gretarsdottir, S., Thorleifsson, G., Thorsteinsdottir, U., Stefansson, K., Boncoraglio, G.B., Parati, E.A., Attia, J., Holliday, E., Levi, C., Franzosi, M.-G., Goel, A., Helgadottir, A., Blackwell, J.M., Bramon, E., Brown, M.A., Casas, J.P., Corvin, A., Duncanson, A., Jankowski, J., Mathew, C.G., Palmer, C.N.A., Plomin, R., Rautanen, A., Sawcer, S.J., Trembath, R.C., Viswanathan, A.C., Wood, N.W., Worrall, B.B., Kittner, S.J., Mitchell, B.D., Kissela, B., Meschia, J.F., Thijs, V., Lindgren, A., MacLeod, M.J., Slowik, A., Walters, M., Rosand, J., Sharma, P., Farrall, M., Sudlow, C.L.M., Rothwell, P.M., Dichgans, M., Donnelly, P., Markus, H.S.",Genome-wide association study identifies a variant in HDAC9 associated with large vessel ischemic stroke,2012,Nature Genetics,328,333,154
"Adler, A.S., Lin, M., Horlings, H., Nuyten, D.S.A., Van De Vijver, M.J., Chang, H.Y.",Genetic regulators of large-scale transcriptional signatures in cancer,2006,Nature Genetics,421,430,155
"Smith, U.M., Consugar, M., Tee, L.J., McKee, B.M., Maina, E.N., Whelan, S., Morgan, N.V., Goranson, E., Gissen, P., Lilliquist, S., Aligianis, I.A., Ward, C.J., Pasha, S., Punyashthiti, R., Sharif, S.M., Batman, P.A., Bennett, C.P., Woods, C.G., McKeown, C., Bucourt, M., Miller, C.A., Cox, P., AlGazali, L., Trembath, R.C., Torres, V.E., Attie-Bitach, T., Kelly, D.A., Maher, E.R., Gattone II, V.H., Harris, P.C., Johnson, C.A.",The transmembrane protein meckelin (MKS3) is mutated in Meckel-Gruber syndrome and the wpk rat,2006,Nature Genetics,191,196,155
"Waters, M.F., Minassian, N.A., Stevanin, G., Figueroa, K.P., Bannister, J.P.A., Nolte, D., Mock, A.F., Evidente, V.G.H., Fee, D.B., Müller, U., Dürr, A., Brice, A., Papazian, D.M., Pulst, S.M.",Mutations in voltage-gated potassium channel KCNC3 cause degenerative and developmental central nervous system phenotypes,2006,Nature Genetics,447,451,155
"Khanna, H., Davis, E.E., Murga-Zamalloa, C.A., Estrada-Cuzcano, A., Lopez, I., Den Hollander, A.I., Zonneveld, M.N., Othman, M.I., Waseem, N., Chakarova, C.F., Maubaret, C., Diaz-Font, A., MacDonald, I., Muzny, D.M., Wheeler, D.A., Morgan, M., Lewis, L.R., Logan, C.V., Tan, P.L., Beer, M.A., Inglehearn, C.F., Lewis, R.A., Jacobson, S.G., Bergmann, C., Beales, P.L., Attié-Bitach, T., Johnson, C.A., Otto, E.A., Bhattacharya, S.S., Hildebrandt, F., Gibbs, R.A., Koenekoop, R.K., Swaroop, A., Katsanis, N.",A common allele in RPGRIP1L is a modifier of retinal degeneration in ciliopathies,2009,Nature Genetics,739,745,155
"Hahn, C.N., Chong, C.-E., Carmichael, C.L., Wilkins, E.J., Brautigan, P.J., Li, X.-C., Babic, M., Lin, M., Carmagnac, A., Lee, Y.K., Kok, C.H., Gagliardi, L., Friend, K.L., Ekert, P.G., Butcher, C.M., Brown, A.L., Lewis, I.D., To, L.B., Timms, A.E., Storek, J., Moore, S., Altree, M., Escher, R., Bardy, P.G., Suthers, G.K., D'Andrea, R.J., Horwitz, M.S., Scott, H.S.",Heritable GATA2 mutations associated with familial myelodysplastic syndrome and acute myeloid leukemia,2011,Nature Genetics,1012,1019,155
"Kyttälä, M., Tallila, J., Salonen, R., Kopra, O., Kohlschmidt, N., Paavola-Sakki, P., Peltonen, L., Kestilä, M.","MKS1, encoding a component of the flagellar apparatus basal body proteome, is mutated in Meckel syndrome",2006,Nature Genetics,155,157,156
"Menne, T.F., Goyenechea, B., Sánchez-Puig, N., Wong, C.C., Tonkin, L.M., Ancliff, P.J., Brost, R.L., Costanzo, M., Boone, C., Warren, A.J.",The Shwachman-Bodian-Diamond syndrome protein mediates translational activation of ribosomes in yeast,2007,Nature Genetics,486,495,156
"Yeger-Lotem, E., Riva, L., Su, L.J., Gitler, A.D., Cashikar, A.G., King, O.D., Auluck, P.K., Geddie, M.L., Valastyan, J.S., Karger, D.R., Lindquist, S., Fraenkel, E.",Bridging high-throughput genetic and transcriptional data reveals cellular responses to alpha-synuclein toxicity,2009,Nature Genetics,316,323,156
"Endele, S., Rosenberger, G., Geider, K., Popp, B., Tamer, C., Stefanova, I., Milh, M., Kortüm, F., Fritsch, A., Pientka, F.K., Hellenbroich, Y., Kalscheuer, V.M., Kohlhase, J., Moog, U., Rappold, G., Rauch, A., Ropers, H.-H., Von Spiczak, S., Tönnies, H., Villeneuve, N., Villard, L., Zabel, B., Zenker, M., Laube, B., Reis, A., Wieczorek, D., Van Maldergem, L., Kutsche, K.",Mutations in GRIN2A and GRIN2B encoding regulatory subunits of NMDA receptors cause variable neurodevelopmental phenotypes,2010,Nature Genetics,1021,1026,156
"Otto, E.A., Hurd, T.W., Airik, R., Chaki, M., Zhou, W., Stoetzel, C., Patil, S.B., Levy, S., Ghosh, A.K., Murga-Zamalloa, C.A., Van Reeuwijk, J., Letteboer, S.J.F., Sang, L., Giles, R.H., Liu, Q., Coene, K.L.M., Estrada-Cuzcano, A., Collin, R.W.J., McLaughlin, H.M., Held, S., Kasanuki, J.M., Ramaswami, G., Conte, J., Lopez, I., Washburn, J., MacDonald, J., Hu, J., Yamashita, Y., Maher, E.R., Guay-Woodford, L.M., Neumann, H.P.H., Obermüller, N., Koenekoop, R.K., Bergmann, C., Bei, X., Lewis, R.A., Katsanis, N., Lopes, V., Williams, D.S., Lyons, R.H., Dang, C.V., Brito, D.A., Dias, M.B., Zhang, X., Cavalcoli, J.D., Nürnberg, G., Nürnberg, P., Pierce, E.A., Jackson, P.K., Antignac, C., Saunier, S., Roepman, R., Dollfus, H., Khanna, H., Hildebrandt, F.",Candidate exome capture identifies mutation of SDCCAG8 as the cause of a retinal-renal ciliopathy,2010,Nature Genetics,840,850,156
"Du, Z., Park, K.-W., Yu, H., Fan, Q., Li, L.",Newly identified prion linked to the chromatin-remodeling factor Swi1 in Saccharomyces cerevisiae,2008,Nature Genetics,460,465,157
"Wu, X., Ye, Y., Kiemeney, L.A., Sulem, P., Rafnar, T., Matullo, G., Seminara, D., Yoshida, T., Saeki, N., Andrew, A.S., Dinney, C.P., Czerniak, B., Zhang, Z.-F., Kiltie, A.E., Bishop, D.T., Vineis, P., Porru, S., Buntinx, F., Kellen, E., Zeegers, M.P., Kumar, R., Rudnai, P., Gurzau, E., Koppova, K., Mayordomo, J.I., Sanchez, M., Saez, B., Lindblom, A., De Verdier, P., Steineck, G., Mills, G.B., Schned, A., Guarrera, S., Polidoro, S., Chang, S.-C., Lin, J., Chang, D.W., Hale, K.S., Majewski, T., Grossman, H.B., Thorlacius, S., Thorsteinsdottir, U., Aben, K.K.H., Witjes, J.A., Stefansson, K., Amos, C.I., Karagas, M.R., Gu, J.",Genetic variation in the prostate stem cell antigen gene PSCA confers susceptibility to urinary bladder cancer,2009,Nature Genetics,991,995,157
"Takata, R., Akamatsu, S., Kubo, M., Takahashi, A., Hosono, N., Kawaguchi, T., Tsunoda, T., Inazawa, J., Kamatani, N., Ogawa, O., Fujioka, T., Nakamura, Y., Nakagawa, H.",Genome-wide association study identifies five new susceptibility loci for prostate cancer in the Japanese population.,2010,Nature genetics,751,754,157
"Hu, Z., Wu, C., Shi, Y., Guo, H., Zhao, X., Yin, Z., Yang, L., Dai, J., Hu, L., Tan, W., Li, Z., Deng, Q., Wang, J., Wu, W., Jin, G., Jiang, Y., Yu, D., Zhou, G., Chen, H., Guan, P., Chen, Y., Shu, Y., Xu, L., Liu, X., Liu, L., Xu, P., Han, B., Bai, C., Zhao, Y., Zhang, H., Yan, Y., Ma, H., Chen, J., Chu, M., Lu, F., Zhang, Z., Chen, F., Wang, X., Jin, L., Lu, J., Zhou, B., Lu, D., Wu, T., Lin, D., Shen, H.",A genome-wide association study identifies two new lung cancer susceptibility loci at 13q12.12 and 22q12.2 in Han Chinese,2011,Nature Genetics,792,796,157
"Fairfax, B.P., Makino, S., Radhakrishnan, J., Plant, K., Leslie, S., Dilthey, A., Ellis, P., Langford, C., Vannberg, F.O., Knight, J.C.",Genetics of gene expression in primary immune cells identifies cell type-specific master regulators and roles of HLA alleles,2012,Nature Genetics,502,510,157
"Kadoch, C., Hargreaves, D.C., Hodges, C., Elias, L., Ho, L., Ranish, J., Crabtree, G.R.",Proteomic and bioinformatic analysis of mammalian SWI/SNF complexes identifies extensive roles in human malignancy,2013,Nature Genetics,592,601,157
"Tischfield, M.A., Bosley, T.M., Salih, M.A.M., Alorainy, I.A., Sener, E.C., Nester, M.J., Oystreck, D.T., Chan, W.-M., Andrews, C., Erickson, R.P., Engle, E.C.","Homozygous HOXA1 mutations disrupt human brainstem, inner ear, cardiovascular and cognitive development",2005,Nature Genetics,1035,1037,158
"Yeh, P., Tschumi, A.I., Kishony, R.",Functional classification of drugs by properties of their pairwise interactions,2006,Nature Genetics,489,494,158
"Ford, C.B., Lin, P.L., Chase, M.R., Shah, R.R., Iartchouk, O., Galagan, J., Mohaideen, N., Ioerger, T.R., Sacchettini, J.C., Lipsitch, M., Flynn, J.L., Fortune, S.M.",Use of whole genome sequencing to estimate the mutation rate of Mycobacterium tuberculosis during latent infection,2011,Nature Genetics,482,488,158
"Xu, B., Ionita-Laza, I., Roos, J.L., Boone, B., Woodrick, S., Sun, Y., Levy, S., Gogos, J.A., Karayiorgou, M.",De novo gene mutations highlight patterns of genetic and neural complexity in schizophrenia,2012,Nature Genetics,1365,1369,158
"Bradshaw, P.S., Stavropoulos, D.J., Meyn, M.S.",Human telomeric protein TRF2 associates with genomic double-strand breaks as an early response to DNA damage,2005,Nature Genetics,193,197,159
"Grzeschik, K.-H., Bornholdt, D., Oeffner, F., König, A., Del Carmen Boente, M., Enders, H., Fritz, B., Hertl, M., Grasshoff, U., Höfling, K., Oji, V., Paradisi, M., Schuchardt, C., Szalai, Z., Tadini, G., Traupe, H., Happle, R.","Deficiency of PORCN, a regulator of Wnt signaling, is associated with focal dermal hypoplasia",2007,Nature Genetics,833,835,159
"Li, Z., Godinho, F.J., Klusmann, J.-H., Garriga-Canut, M., Yu, C., Orkin, S.H.",Developmental stage-selective effect of somatically mutated leukemogenic transcription factor GATA1,2005,Nature Genetics,613,619,160
"Pansuriya, T.C., Van Eijk, R., D'Adamo, P., Van Ruler, M.A.J.H., Kuijjer, M.L., Oosting, J., Cleton-Jansen, A.-M., Van Oosterwijk, J.G., Verbeke, S.L.J., Meijer, D., Van Wezel, T., Nord, K.H., Sangiorgi, L., Toker, B., Liegl-Atzwanger, B., San-Julian, M., Sciot, R., Limaye, N., Kindblom, L.-G., Daugaard, S., Godfraind, C., Boon, L.M., Vikkula, M., Kurek, K.C., Szuhai, K., French, P.J., Bovée, J.V.M.G.",Somatic mosaic IDH1 and IDH2 mutations are associated with enchondroma and spindle cell hemangioma in Ollier disease and Maffucci syndrome,2011,Nature Genetics,1256,1261,160
"Dieterich, C., Clifton, S.W., Schuster, L.N., Chinwalla, A., Delehaunty, K., Dinkelacker, I., Fulton, L., Fulton, R., Godfrey, J., Minx, P., Mitreva, M., Roeseler, W., Tian, H., Witte, H., Yang, S.-P., Wilson, R.K., Sommer, R.J.",The Pristionchus pacificus genome provides a unique perspective on nematode lifestyle and parasitism,2008,Nature Genetics,1193,1198,161
"Dendrou, C.A., Plagnol, V., Fung, E., Yang, J.H.M., Downes, K., Cooper, J.D., Nutland, S., Coleman, G., Himsworth, M., Hardy, M., Burren, O., Healy, B., Walker, N.M., Koch, K., Ouwehand, W.H., Bradley, J.R., Wareham, N.J., Todd, J.A., Wicker, L.S.",Cell-specific protein phenotypes for the autoimmune locus IL2RA using a genotype-selectable human bioresource,2009,Nature Genetics,1011,1015,161
"Hogan, B.M., Bos, F.L., Bussmann, J., Witte, M., Chi, N.C., Duckers, H.J., Schulte-Merker, S.",Ccbe1 is required for embryonic lymphangiogenesis and venous sprouting,2009,Nature Genetics,396,398,161
"Ong, K.K., Elks, C.E., Li, S., Zhao, J.H., Luan, J., Andersen, L.B., Bingham, S.A., Brage, S., Smith, G.D., Ekelund, U., Gillson, C.J., Glaser, B., Golding, J., Hardy, R., Khaw, K.-T., Kuh, D., Luben, R., Marcus, M., McGeehin, M.A., Ness, A.R., Northstone, K., Ring, S.M., Rubin, C., Sims, M.A., Song, K., Strachan, D.P., Vollenweider, P., Waeber, G., Waterworth, D.M., Wong, A., Deloukas, P., Barroso, I., Mooser, V., Loos, R.J., Wareham, N.J.",Genetic variation in LIN28B is associated with the timing of puberty,2009,Nature Genetics,729,733,161
"Yeager, M., Chatterjee, N., Ciampa, J., Jacobs, K.B., Gonzalez-Bosquet, J., Hayes, R.B., Kraft, P., Wacholder, S., Orr, N., Berndt, S., Yu, K., Hutchinson, A., Wang, Z., Amundadottir, L., Feigelson, H.S., Thun, M.J., Diver, W.R., Albanes, D., Virtamo, J., Weinstein, S., Schumacher, F.R., Cancel-Tassin, G., Cussenot, O., Valeri, A., Andriole, G.L., Crawford, E.D., Haiman, C.A., Henderson, B., Kolonel, L., Le Marchand, L., Siddiq, A., Riboli, E., Key, T.J., Kaaks, R., Isaacs, W., Isaacs, S., Wiley, K.E., Gronberg, H., Wiklund, F., Stattin, P., Xu, J., Zheng, S.L., Sun, J., Vatten, L.J., Hveem, K., Kumle, M., Tucker, M., Gerhard, D.S., Hoover, R.N., Fraumeni, J.F., Hunter, D.J., Thomas, G., Chanock, S.J.",Identification of a new prostate cancer susceptibility locus on chromosome 8q24,2009,Nature Genetics,1055,1057,161
"Cho, M.H., Boutaoui, N., Klanderman, B.J., Sylvia, J.S., Ziniti, J.P., Hersh, C.P., Demeo, D.L., Hunninghake, G.M., Litonjua, A.A., Sparrow, D., Lange, C., Won, S., Murphy, J.R., Beaty, T.H., Regan, E.A., Make, B.J., Hokanson, J.E., Crapo, J.D., Kong, X., Anderson, W.H., Tal-Singer, R., Lomas, D.A., Bakke, P., Gulsvik, A., Pillai, S.G., Silverman, E.K.",Variants in FAM13A are associated with chronic obstructive pulmonary disease,2010,Nature Genetics,200,202,161
"Martínez-Estrada, O.M., Lettice, L.A., Essafi, A., Guadix, J.A., Slight, J., Velecela, V., Hall, E., Reichmann, J., Devenney, P.S., Hohenstein, P., Hosen, N., Hill, R.E., Mũoz-Chapuli, R., Hastie, N.D.",Wt1 is required for cardiovascular progenitor cell formation through transcriptional control of Snail and E-cadherin,2010,Nature Genetics,89,93,161
"Bojesen, S.E., Pooley, K.A., Johnatty, S.E., Beesley, J., Michailidou, K., Tyrer, J.P., Edwards, S.L., Pickett, H.A., Shen, H.C., Smart, C.E., Hillman, K.M., Mai, P.L., Lawrenson, K., Stutz, M.D., Lu, Y., Karevan, R., Woods, N., Johnston, R.L., French, J.D., Chen, X., Weischer, M., Nielsen, S.F., Maranian, M.J., Ghoussaini, M., Ahmed, S., Baynes, C., Bolla, M.K., Wang, Q., Dennis, J., McGuffog, L., Barrowdale, D., Lee, A., Healey, S., Lush, M., Tessier, D.C., Vincent, D., Bacot, F., Vergote, I., Lambrechts, S., Despierre, E., Risch, H.A., González-Neira, A., Rossing, M.A., Pita, G., Doherty, J.A., Álvarez, N., Larson, M.C., Fridley, B.L., Schoof, N., Chang-Claude, J., Cicek, M.S., Peto, J., Kalli, K.R., Broeks, A., Armasu, S.M., Schmidt, M.K., Braaf, L.M., Winterhoff, B., Nevanlinna, H., Konecny, G.E., Lambrechts, D., Rogmann, L., Guénel, P., Teoman, A., Milne, R.L., Garcia, J.J., Cox, A., Shridhar, V., Burwinkel, B., Marme, F., Hein, R., Sawyer, E.J., Haiman, C.A., Wang-Gohrke, S., Andrulis, I.L., Moysich, K.B., Hopper, J.L., Odunsi, K., Lindblom, A., Giles, G.G., Brenner, H., Simard, J., Lurie, G., Fasching, P.A., Carney, M.E., Radice, P., Wilkens, L.R., Swerdlow, A., Goodman, M.T., Brauch, H., Garcia-Closas, M., Hillemanns, P., Winqvist, R., Dürst, M., Devilee, P., Runnebaum, I., Jakubowska, A., Lubinski, J., Mannermaa, A., Butzow, R., Bogdanova, N.V., Dörk, T., Pelttari, L.M., Zheng, W., Leminen, A., Anton-Culver, H., Bunker, C.H., Kristensen, V., Ness, R.B., Muir, K., Edwards, R., Meindl, A., Heitz, F., Matsuo, K., Du Bois, A., Wu, A.H., Harter, P., Teo, S.-H., Schwaab, I., Shu, X.-O., Blot, W., Hosono, S., Kang, D., Nakanishi, T., Hartman, M., Yatabe, Y., Hamann, U., Karlan, B.Y., Sangrajrang, S., Kjaer, S.K., Gaborieau, V., Jensen, A., Eccles, D., Høgdall, E., Shen, C.-Y., Brown, J., Woo, Y.L., Shah, M., Azmi, M.A.N., Luben, R., Omar, S.Z., Czene, K., Vierkant, R.A., Nordestgaard, Bø.G., Flyger, H., Vachon, C., Olson, J.E., Wang, X., Levine, D.A., Rudolph, A., Weber, R.P., Flesch-Janys, D., Iversen, E., Nickels, S., Schildkraut, J.M., Silva, I.D.S., Cramer, D.W., Gibson, L., Terry, K.L., Fletcher, O., Vitonis, A.F., Van Der Schoot, C.E., Poole, E.M., Hogervorst, F.B.L., Tworoger, S.S., Liu, J., Bandera, E.V., Li, J., Olson, S.H., Humphreys, K., Orlow, I., Blomqvist, C., Rodriguez-Rodriguez, L., Aittomäki, K., Salvesen, H.B., Muranen, T.A., Wik, E., Brouwers, B., Krakstad, C., Wauters, E., Halle, M.K., Wildiers, H., Kiemeney, L.A., Mulot, C., Aben, K.K., Laurent-Puig, P., Altena, A.M., Truong, T., Massuger, L.F.A.G., Benitez, J., Pejovic, T., Perez, J.I.A., Hoatlin, M., Zamora, M.P., Cook, L.S., Balasubramanian, S.P., Kelemen, L.E., Schneeweiss, A., Le, N.D., Sohn, C., Brooks-Wilson, A., Tomlinson, I., Kerin, M.J., Miller, N., Cybulski, C., Henderson, B.E., Menkiszak, J., Schumacher, F., Wentzensen, N., Le Marchand, L., Yang, H.P., Mulligan, A.M., Glendon, G., Engelholm, S.A., Knight, J.A., Høgdall, C.K., Apicella, C., Gore, M., Tsimiklis, H., Song, H., Southey, M.C., Jager, A., Den Ouweland, A.M.W., Brown, R., Martens, J.W.M., Flanagan, J.M., Kriege, M., Paul, J., Margolin, S., Siddiqui, N., Severi, G., Whittemore, A.S., Baglietto, L., McGuire, V., Stegmaier, C., Sieh, W., Müller, H., Arndt, V., Labrèche, F., Gao, Y.-T., Goldberg, M.S., Yang, G., Dumont, M., McLaughlin, J.R., Hartmann, A., Ekici, A.B., Beckmann, M.W., Phelan, C.M., Lux, M.P., Permuth-Wey, J., Peissel, B., Sellers, T.A., Ficarazzi, F., Barile, M., Ziogas, A., Ashworth, A., Gentry-Maharaj, A., Jones, M., Ramus, S.J., Orr, N., Menon, U., Pearce, C.L., Brüning, T., Pike, M.C., Ko, Y.-D., Lissowska, J., Figueroa, J., Kupryjanczyk, J., Chanock, S.J., Dansonka-Mieszkowska, A., Jukkola-Vuorinen, A., Rzepecka, I.K., Pylkäs, K., Bidzinski, M., Kauppila, S., Hollestelle, A., Seynaeve, C., Tollenaar, R.A.E.M., Durda, K., Jaworska, K., Hartikainen, J.M., Kosma, V.-M., Kataja, V., Antonenkova, N.N., Long, J., Shrubsole, M., Deming-Halverson, S., Lophatananon, A., Siriwanarangsan, P., Stewart-Brown, S., Ditsch, N., Lichtner, P., Schmutzler, R.K., Ito, H., Iwata, H., Tajima, K., Tseng, C.-C., Stram, D.O., Van Den Berg, D., Yip, C.H., Ikram, M.K., Teh, Y.-C., Cai, H., Lu, W., Signorello, L.B., Cai, Q., Noh, D.-Y., Yoo, K.-Y., Miao, H., Iau, P.T.-C., Teo, Y.Y., McKay, J., Shapiro, C., Ademuyiwa, F., Fountzilas, G., Hsiung, C.-N., Yu, J.-C., Hou, M.-F., Healey, C.S., Luccarini, C., Peock, S., Stoppa-Lyonnet, D., Peterlongo, P., Rebbeck, T.R., Piedmonte, M., Singer, C.F., Friedman, E., Thomassen, M., Offit, K., Hansen, T.V.O., Neuhausen, S.L., Szabo, C.I., Blanco, I., Garber, J., Narod, S.A., Weitzel, J.N., Montagna, M., Olah, E., Godwin, A.K., Yannoukakos, D., Goldgar, D.E., Caldes, T., Imyanitov, E.N., Tihomirova, L., Arun, B.K., Campbell, I., Mensenkamp, A.R., Van Asperen, C.J., Van Roozendaal, K.E.P., Meijers-Heijboer, H., Collée, J.M., Oosterwijk, J.C., Hooning, M.J., Rookus, M.A., Van Der Luijt, R.B., Os, T.A.M., Evans, D.G., Frost, D., Fineberg, E., Barwell, J., Walker, L., Kennedy, M.J., Platte, R., Davidson, R., Ellis, S.D., Cole, T., Bressac-De Paillerets, B., Buecher, B., Damiola, F., Faivre, L., Frenay, M., Sinilnikova, O.M., Caron, O., Giraud, S., Mazoyer, S., Bonadona, V., Caux-Moncoutier, V., Toloczko-Grabarek, A., Gronwald, J., Byrski, T., Spurdle, A.B., Bonanni, B., Zaffaroni, D., Giannini, G., Bernard, L., Dolcetti, R., Manoukian, S., Arnold, N., Engel, C., Deissler, H., Rhiem, K., Niederacher, D., Plendl, H., Sutter, C., Wappenschmidt, B., Borg, Å., Melin, B., Rantala, J., Soller, M., Nathanson, K.L., Domchek, S.M., Rodriguez, G.C., Salani, R., Kaulich, D.G., Tea, M.-K., Paluch, S.S., Laitman, Y., Skytte, A.-B., Kruse, T.A., Jensen, U.B., Robson, M., Gerdes, A.-M., Ejlertsen, B., Foretova, L., Savage, S.A., Lester, J., Soucy, P., Kuchenbaecker, K.B., Olswold, C., Cunningham, J.M., Slager, S., Pankratz, V.S., Dicks, E., Lakhani, S.R., Couch, F.J., Hall, P., Monteiro, A.N.A., Gayther, S.A., Pharoah, P.D.P., Reddel, R.R., Goode, E.L., Greene, M.H., Easton, D.F., Berchuck, A., Antoniou, A.C., Chenevix-Trench, G., Dunning, A.M.",Multiple independent variants at the TERT locus are associated with telomere length and risks of breast and ovarian cancer,2013,Nature Genetics,371,384,161
"Toy, W., Shen, Y., Won, H., Green, B., Sakr, R.A., Will, M., Li, Z., Gala, K., Fanning, S., King, T.A., Hudis, C., Chen, D., Taran, T., Hortobagyi, G., Greene, G., Berger, M., Baselga, J., Chandarlapaty, S.",ESR1 ligand-binding domain mutations in hormone-resistant breast cancer,2013,Nature Genetics,1439,1445,161
"Köhler, C., Page, D.R., Gagliardini, V., Grossniklaus, U.",The Arabidopsis thaliana MEDEA Polycomb group protein controls expression of PHERES1 by parental imprinting,2005,Nature Genetics,28,30,162
"Mehrabian, M., Allayee, H., Stockton, J., Pek, Y.L., Drake, T.A., Castellani, L.W., Suh, M., Armour, C., Edwards, S., Lamb, J., Lusis, A.J., Schadt, E.E.",Integrating genotypic and expression data in a segregating mouse population to identify 5-lipoxygenase as a susceptibility gene for obesity and bone traits,2005,Nature Genetics,1224,1233,162
"Bergamaschi, D., Samuels, Y., Sullivan, A., Zvelebil, M., Breyssens, H., Bisso, A., Del Sal, G., Syed, N., Smith, P., Gasco, M., Crook, T., Lu, X.",iASPP preferentially binds p53 proline-rich region and modulates apoptotic function of codon 72-polymorphic p53,2006,Nature Genetics,1133,1141,162
"Carlborg, Ö., Jacobsson, L., Åhgren, P., Siegel, P., Andersson, L.",Epistasis and the release of genetic variation during long-term selection,2006,Nature Genetics,418,420,162
"Ferrante, M.I., Zullo, A., Barra, A., Bimonte, S., Messaddeq, N., Studer, M., Dollé, P., Franco, B.",Oral-facial-digital type I protein is required for primary cilia formation and left-right axis specification,2006,Nature Genetics,112,117,162
