Authors,Title,Year,Source title,Page start,Page end,Cited by
"Mi, W., Pawlik, M., Sastre, M., Jung, S.S., Radvinsky, D.S., Klein, A.M., Sommer, J., Schmidt, S.D., Nixon, R.A., Mathews, P.M., Levy, E.",Cystatin C inhibits amyloid-β deposition in Alzheimer's disease mouse models,2007,Nature Genetics,1440,1442,93
"Pennington, J.M., Rosenberg, S.M.",Spontaneous DNA breakage in single living Escherichia coli cells,2007,Nature Genetics,797,802,93
"Schmahl, J., Raymond, C.S., Soriano, P.",PDGF signaling specificity is mediated through multiple immediate early genes,2007,Nature Genetics,52,60,93
"Xiong, Y., Chen, X., Chen, Z., Wang, X., Shi, S., Wang, X., Zhang, J., He, X.",RNA sequencing shows no dosage compensation of the active X-chromosome,2010,Nature Genetics,1043,1047,93
"Matmati, M., Jacques, P., Maelfait, J., Verheugen, E., Kool, M., Sze, M., Geboes, L., Louagie, E., Guire, C.M., Vereecke, L., Chu, Y., Boon, L., Staelens, S., Matthys, P., Lambrecht, B.N., Schmidt-Supprian, M., Pasparakis, M., Elewaut, D., Beyaert, R., Van Loo, G.",A20 (TNFAIP3) deficiency in myeloid cells triggers erosive polyarthritis resembling rheumatoid arthritis,2011,Nature Genetics,908,912,93
"Louis-Dit-Picard, H., Barc, J., Trujillano, D., Miserey-Lenkei, S., Bouatia-Naji, N., Pylypenko, O., Beaurain, G., Bonnefond, A., Sand, O., Simian, C., Vidal-Petiot, E., Soukaseum, C., Mandet, C., Broux, F., Chabre, O., Delahousse, M., Esnault, V., Fiquet, B., Houillier, P., Bagnis, C.I., Koenig, J., Konrad, M., Landais, P., Mourani, C., Niaudet, P., Probst, V., Thauvin, C., Unwin, R.J., Soroka, S.D., Ehret, G., Ossowski, S., Caulfield, M., Bruneval, P., Estivill, X., Froguel, P., Hadchouel, J., Schott, J.-J., Jeunemaitre, X.",KLHL3 mutations cause familial hyperkalemic hypertension by impairing ion transport in the distal nephron,2012,Nature Genetics,456,460,93
"Onouchi, Y., Ozaki, K., Burns, J.C., Shimizu, C., Terai, M., Hamada, H., Honda, T., Suzuki, H., Suenaga, T., Takeuchi, T., Yoshikawa, N., Suzuki, Y., Yasukawa, K., Ebata, R., Higashi, K., Saji, T., Kemmotsu, Y., Takatsuki, S., Ouchi, K., Kishi, F., Yoshikawa, T., Nagai, T., Hamamoto, K., Sato, Y., Honda, A., Kobayashi, H., Sato, J., Shibuta, S., Miyawaki, M., Oishi, K., Yamaga, H., Aoyagi, N., Iwahashi, S., Miyashita, R., Murata, Y., Sasago, K., Takahashi, A., Kamatani, N., Kubo, M., Tsunoda, T., Hata, A., Nakamura, Y., Tanaka, T., Abe, J., Kobayashi, T., Arakawa, H., Ichida, F., Nomura, Y., Miura, M., Ikeda, K., Hara, T., Fukazawa, R., Ogawa, S., Hamaoka, K., Newburger, J.W., Baker, A.L., Rowley, A.H., Shulman, S.T., Melish, M.E., Mason, W.H., Takahashi, M., Tremoulet, A.H.",A genome-wide association study identifies three new risk loci for Kawasaki disease,2012,Nature Genetics,517,521,93
"Nakanishi, Y., Seno, H., Fukuoka, A., Ueo, T., Yamaga, Y., Maruno, T., Nakanishi, N., Kanda, K., Komekado, H., Kawada, M., Isomura, A., Kawada, K., Sakai, Y., Yanagita, M., Kageyama, R., Kawaguchi, Y., Taketo, M.M., Yonehara, S., Chiba, T.",Dclk1 distinguishes between tumor and normal stem cells in the intestine,2013,Nature Genetics,98,103,93
"Roy, C.N., Custodio, Á.O., De Graaf, J., Schneider, S., Akpan, I., Montross, L.K., Sanchez, M., Gaudino, A., Hentze, M.W., Andrews, N.C., Muckenthaler, M.U.",An Hfe-dependent pathway mediates hyposideremia in response to lipopolysaccharide-induced inflammation in mice,2004,Nature Genetics,481,485,94
"Kaeser, S.A., Herzig, M.C., Coomaraswamy, J., Kilger, E., Selenica, M.-L., Winkler, D.T., Staufenbiel, M., Levy, E., Grubb, A., Jucker, M.",Cystatin C modulates cerebral β-amyloidosis,2007,Nature Genetics,1437,1439,94
"Gretarsdottir, S., Baas, A.F., Thorleifsson, G., Holm, H., Den Heijer, M., De Vries, J.-P.P.M., Kranendonk, S.E., Zeebregts, C.J.A.M., Van Sterkenburg, S.M., Geelkerken, R.H., Van Rij, A.M., Williams, M.J.A., Boll, A.P.M., Kostic, J.P., Jonasdottir, A., Jonasdottir, A., Walters, G.B., Masson, G., Sulem, P., Saemundsdottir, J., Mouy, M., Magnusson, K.P., Tromp, G., Elmore, J.R., Sakalihasan, N., Limet, R., Defraigne, J.-O., Ferrell, R.E., Ronkainen, A., Ruigrok, Y.M., Wijmenga, C., Grobbee, D.E., Shah, S.H., Granger, C.B., Quyyumi, A.A., Vaccarino, V., Patel, R.S., Zafari, A.M., Levey, A.I., Austin, H., Girelli, D., Pignatti, P.F., Olivieri, O., Martinelli, N., Malerba, G., Trabetti, E., Becker, L.C., Becker, D.M., Reilly, M.P., Rader, D.J., Mueller, T., Dieplinger, B., Haltmayer, M., Urbonavicius, S., Lindblad, B., Gottsäter, A., Gaetani, E., Pola, R., Wells, P., Rodger, M., Forgie, M., Langlois, N., Corral, J., Vicente, V., Fontcuberta, J., España, F., Grarup, N., Jørgensen, T., Witte, D.R., Hansen, T., Pedersen, O., Aben, K.K., De Graaf, J., Holewijn, S., Folkersen, L., Franco-Cereceda, A., Eriksson, P., Collier, D.A., Stefansson, H., Steinthorsdottir, V., Rafnar, T., Valdimarsson, E.M., Magnadottir, H.B., Sveinbjornsdottir, S., Olafsson, I., Magnusson, M.K., Palmason, R., Haraldsdottir, V., Andersen, K., Onundarson, P.T., Thorgeirsson, G., Kiemeney, L.A., Powell, J.T., Carey, D.J., Kuivaniemi, H., Lindholt, J.S., Jones, G.T., Kong, A., Blankensteijn, J.D., Matthiasson, S.E., Thorsteinsdottir, U., Stefansson, K.",Genome-wide association study identifies a sequence variant within the DAB2IP gene conferring susceptibility to abdominal aortic aneurysm,2010,Nature Genetics,692,697,94
"Jiao, Y., Zhao, H., Ren, L., Song, W., Zeng, B., Guo, J., Wang, B., Liu, Z., Chen, J., Li, W., Zhang, M., Xie, S., Lai, J.",Genome-wide genetic changes during modern breeding of maize,2012,Nature Genetics,812,815,94
"Bruce, L.J., Robinson, H.C., Guizouarn, H., Borgese, F., Harrison, P., King, M.-J., Goede, J.S., Coles, S.E., Gore, D.M., Lutz, H.U., Ficarella, R., Layton, D.M., Iolascon, A., Ellory, J.C., Stewart, G.W.","Monovalent cation leaks in human red cells caused by single amino-acid substitutions in the transport domain of the band 3 chloride-bicarbonate exchanger, AE1",2005,Nature Genetics,1258,1263,95
"Wong, S., Wolfe, K.H.",Birth of a metabolic gene cluster in yeast by adaptive gene relocation,2005,Nature Genetics,777,782,95
"Aldinger, K.A., Lehmann, O.J., Hudgins, L., Chizhikov, V.V., Bassuk, A.G., Ades, L.C., Krantz, I.D., Dobyns, W.B., Millen, K.J.",FOXC1 is required for normal cerebellar development and is a major contributor to chromosome 6p25.3 Dandy-Walker malformation,2009,Nature Genetics,1037,1042,95
"Jenkins, Z.A., Van Kogelenberg, M., Morgan, T., Jeffs, A., Fukuzawa, R., Pearl, E., Thaller, C., Hing, A.V., Porteous, M.E., Garcia-Mĩaur, S., Bohring, A., Lacombe, D., Stewart, F., Fiskerstrand, T., Bindoff, L., Berland, S., Adès, L.C., Tchan, M., David, A., Wilson, L.C., Hennekam, R.C.M., Donnai, D., Mansour, S., Cormier-Daire, V., Robertson, S.P.",Germline mutations in WTX cause a sclerosing skeletal dysplasia but do not predispose to tumorigenesis,2009,Nature Genetics,95,100,95
"Kim, Y.J., Go, M.J., Hu, C., Hong, C.B., Kim, Y.K., Lee, J.Y., Hwang, J.-Y., Oh, J.H., Kim, D.-J., Kim, N.H., Kim, S., Hong, E.J., Kim, J.-H., Min, H., Kim, Y., Zhang, R., Jia, W., Okada, Y., Takahashi, A., Kubo, M., Tanaka, T., Kamatani, N., Matsuda, K., Park, T., Oh, B., Kimm, K., Kang, D., Shin, C., Cho, N.H., Kim, H.-L., Han, B.-G., Lee, J.-Y., Cho, Y.S.",Large-scale genome-wide association studies in east Asians identify new genetic loci influencing metabolic traits,2011,Nature Genetics,990,997,95
"Lu, X., Wang, L., Chen, S., He, L., Yang, X., Shi, Y., Cheng, J., Zhang, L., Gu, C.C., Huang, J., Wu, T., Ma, Y., Li, J., Cao, J., Chen, J., Ge, D., Fan, Z., Li, Y., Zhao, L., Li, H., Zhou, X., Chen, L., Liu, D., Chen, J., Duan, X., Hao, Y., Wang, L., Lu, F., Liu, Z., Yao, C., Shen, C., Pu, X., Yu, L., Fang, X., Xu, L., Mu, J., Wu, X., Zheng, R., Wu, N., Zhao, Q., Li, Y., Liu, X., Wang, M., Yu, D., Hu, D., Ji, X., Guo, D., Sun, D., Wang, Q., Yang, Y., Liu, F., Mao, Q., Liang, X., Ji, J., Chen, P., Mo, X., Li, D., Chai, G., Tang, Y., Li, X., Du, Z., Liu, X., Dou, C., Yang, Z., Meng, Q., Wang, D., Wang, R., Yang, J., Schunkert, H., Samani, N.J., Kathiresan, S., Reilly, M.P., Erdmann, J., Peng, X., Wu, X., Liu, D., Yang, Y., Chen, R., Qiang, B., Gu, D.",Genome-wide association study in Han Chinese identifies four new susceptibility loci for coronary artery disease,2012,Nature Genetics,890,894,95
"Okada, Y., Kubo, M., Ohmiya, H., Takahashi, A., Kumasaka, N., Hosono, N., Maeda, S., Wen, W., Dorajoo, R., Go, M.J., Zheng, W., Kato, N., Wu, J.-Y., Lu, Q., Tsunoda, T., Yamamoto, K., Nakamura, Y., Kamatani, N., Tanaka, T.",Common variants at CDKAL1 and KLF9 are associated with body mass index in east Asian populations,2012,Nature Genetics,302,306,95
"Sun, J.X., Helgason, A., Masson, G., Ebenesersdóttir, S.S., Li, H., Mallick, S., Gnerre, S., Patterson, N., Kong, A., Reich, D., Stefansson, K.",A direct characterization of human mutation based on microsatellites,2012,Nature Genetics,1161,1165,95
"Blaydon, D.C., Ishii, Y., O'Toole, E.A., Unsworth, H.C., Teh, M.-T., Rüschendorf, F., Sinclair, C., Hopsu-Havu, V.K., Tidman, N., Moss, C., Watson, R., De Berker, D., Wajid, M., Christiano, A.M., Kelsell, D.P.","The gene encoding R-spondin 4 (RSPO4), a secreted protein implicated in Wnt signaling, is mutated in inherited anonychia",2006,Nature Genetics,1245,1247,96
"Hollanda, L.M., Lima, C.S.P., Cunha, A.F., Albuquerque, D.M., Vassallo, J., Ozelo, M.C., Joazeiro, P.P., Saad, S.T.O., Costa, F.F.",An inherited mutation leading to production of only the short isoform of GATA-1 is associated with impaired erythropoiesis,2006,Nature Genetics,807,812,96
"Risheg, H., Graham, J.M., Clark, R.D., Rogers, R.C., Opitz, J.M., Moeschler, J.B., Peiffer, A.P., May, M., Joseph, S.M., Jones, J.R., Stevenson, R.E., Schwartz, C.E., Friez, M.J.",A recurrent mutation in MED12 leading to R961W causes Opitz-Kaveggia syndrome,2007,Nature Genetics,451,453,96
"Skibola, C.F., Bracci, P.M., Halperin, E., Conde, L., Craig, D.W., Agana, L., Iyadurai, K., Becker, N., Brooks-Wilson, A., Curry, J.D., Spinelli, J.J., Holly, E.A., Riby, J., Zhang, L., Nieters, A., Smith, M.T., Brown, K.M.",Genetic variants at 6p21.33 are associated with susceptibility to follicular lymphoma,2009,Nature Genetics,873,875,96
"Franke, A., Balschun, T., Sina, C., Ellinghaus, D., Häsler, R., Mayr, G., Albrecht, M., Wittig, M., Buchert, E., Nikolaus, S., Gieger, C., Wichmann, H.E., Sventoraityte, J., Kupcinskas, L., Onnie, C.M., Gazouli, M., Anagnou, N.P., Strachan, D., McArdle, W.L., Mathew, C.G., Rutgeerts, P., Vermeire, S., Vatn, M.H., Krawczak, M., Rosenstiel, P., Karlsen, T.H., Schreiber, S.",Genome-wide association study for ulcerative colitis identifies risk loci at 7q22 and 22q13 (IL17REL),2010,Nature Genetics,292,294,96
"Kahr, W.H.A., Hinckley, J., Li, L., Schwertz, H., Christensen, H., Rowley, J.W., Pluthero, F.G., Urban, D., Fabbro, S., Nixon, B., Gadzinski, R., Storck, M., Wang, K., Ryu, G.-Y., Jobe, S.M., Schutte, B.C., Moseley, J., Loughran, N.B., Parkinson, J., Weyrich, A.S., Di Paola, J.","Mutations in NBEAL2, encoding a BEACH protein, cause gray platelet syndrome",2011,Nature Genetics,738,740,96
"Huang, Y., Li, Y., Burt, D.W., Chen, H., Zhang, Y., Qian, W., Kim, H., Gan, S., Zhao, Y., Li, J., Yi, K., Feng, H., Zhu, P., Li, B., Liu, Q., Fairley, S., Magor, K.E., Du, Z., Hu, X., Goodman, L., Tafer, H., Vignal, A., Lee, T., Kim, K.-W., Sheng, Z., An, Y., Searle, S., Herrero, J., Groenen, M.A.M., Crooijmans, R.P.M.A., Faraut, T., Cai, Q., Webster, R.G., Aldridge, J.R., Warren, W.C., Bartschat, S., Kehr, S., Marz, M., Stadler, P.F., Smith, J., Kraus, R.H.S., Zhao, Y., Ren, L., Fei, J., Morisson, M., Kaiser, P., Griffin, D.K., Rao, M., Pitel, F., Wang, J., Li, N.",The duck genome and transcriptome provide insight into an avian influenza virus reservoir species,2013,Nature Genetics,776,783,96
"Adams, D.J., Biggs, P.J., Cox, T., Davies, R., Van Der Weyden, L., Jonkers, J., Smith, J., Plumb, B., Taylor, R., Nishijima, I., Yu, Y., Rogers, J., Bradley, A.",Mutagenic insertion and chromosome engineering resource (MICER),2004,Nature Genetics,867,871,97
"Kong, A., Barnard, J., Gudbjartsson, D.F., Thorleifsson, G., Jonsdottir, G., Sigurdardottir, S., Richardsson, B., Jonsdottir, J., Thorgeirsson, T., Frigge, M.L., Lamb, N.E., Sherman, S., Gulcher, J.R., Stefansson, K.",Recombination rate and reproductive success in humans,2004,Nature Genetics,1203,1206,97
"Huber, C., Dias-Santagata, D., Glaser, A., O'Sullivan, J., Brauner, R., Wu, K., Xu, X., Pearce, K., Wang, R., Uzielli, M.L.G., Dagoneau, N., Chemaitilly, W., Superti-Furga, A., Dos Santos, H., Mégarbané, A., Morin, G., Gillessen-Kaesbach, G., Hennekam, R., Van Der Burgt, I., Black, G.C.M., Clayton, P.E., Read, A., Le Merrer, M., Scambler, P.J., Munnich, A., Pan, Z.-Q., Winter, R., Cormier-Daire, V.",Identification of mutations in CUL7 in 3-M syndrome,2005,Nature Genetics,1119,1124,97
"Dumas, M.-E., Wilder, S.P., Bihoreau, M.-T., Barton, R.H., Fearnside, J.F., Argoud, K., D'Amato, L., Wallis, R.H., Blancher, C., Keun, H.C., Baunsgaard, D., Scott, J., Sidelmann, U.G., Nicholson, J.K., Gauguier, D.",Direct quantitative trait locus mapping of mammalian metabolic phenotypes in diabetic and normoglycemic rat models,2007,Nature Genetics,666,672,97
"Egan, C.M., Sridhar, S., Wigler, M., Hall, I.M.",Recurrent DNA copy number variation in the laboratory mouse,2007,Nature Genetics,1384,1389,97
"Franklin, K.A., Whitelam, G.C.",Light-quality regulation of freezing tolerance in Arabidopsis thaliana,2007,Nature Genetics,1410,1413,97
"McClean, M.N., Mody, A., Broach, J.R., Ramanathan, S.",Cross-talk and decision making in MAP kinase pathways,2007,Nature Genetics,409,414,97
"Shukla, V., Coumoul, X., Wang, R.-H., Kim, H.-S., Deng, C.-X.",RNA interference and inhibition of MEK-ERK signaling prevent abnormal skeletal phenotypes in a mouse model of craniosynostosis,2007,Nature Genetics,1145,1150,97
"Budde, B.S., Namavar, Y., Barth, P.G., Poll-The, B.T., Nürnberg, G., Becker, C., Van Ruissen, F., Weterman, M.A.J., Fluiter, K., Te Beek, E.T., Aronica, E., Van Der Knaap, M.S., Höhne, W., Toliat, M.R., Crow, Y.J., Steinlin, M., Voit, T., Roelens, F., Brussel, W., Brockmann, K., Kyllerman, M., Boltshauser, E., Hammersen, G., Willemsen, M., Basel-Vanagaite, L., Krägeloh-Mann, I., De Vries, L.S., Sztriha, L., Muntoni, F., Ferrie, C.D., Battini, R., Hennekam, R.C.M., Grillo, E., Beemer, F.A., Stoets, L.M.E., Wollnik, B., Nürnberg, P., Baas, F.",tRNA splicing endonuclease mutations cause pontocerebellar hypoplasia,2008,Nature Genetics,1113,1118,97
"Smits, G., Mungall, A.J., Griffiths-Jones, S., Smith, P., Beury, D., Matthews, L., Rogers, J., Pask, A.J., Shaw, G., VandeBerg, J.L., McCarrey, J.R., Renfree, M.B., Reik, W., Dunham, I.",Conservation of the H19 noncoding RNA and H19-IGF2 imprinting mechanism in therians,2008,Nature Genetics,971,976,97
"Galarneau, G., Palmer, C.D., Sankaran, V.G., Orkin, S.H., Hirschhorn, J.N., Lettre, G.",Fine-mapping at three loci known to affect fetal hemoglobin levels explains additional genetic variation,2010,Nature Genetics,1049,1051,97
"Deng, X., Hiatt, J.B., Nguyen, D.K., Ercan, S., Sturgill, D., Hillier, L.W., Schlesinger, F., Davis, C.A., Reinke, V.J., Gingeras, T.R., Shendure, J., Waterston, R.H., Oliver, B., Lieb, J.D., Disteche, C.M.","Evidence for compensatory upregulation of expressed X-linked genes in mammals, Caenorhabditis elegans and Drosophila melanogaster",2011,Nature Genetics,1179,1185,97
"Haiman, C.A., Chen, G.K., Blot, W.J., Strom, S.S., Berndt, S.I., Kittles, R.A., Rybicki, B.A., Isaacs, W.B., Ingles, S.A., Stanford, J.L., Diver, W.R., Witte, J.S., Hsing, A.W., Nemesure, B., Rebbeck, T.R., Cooney, K.A., Xu, J., Kibel, A.S., Hu, J.J., John, E.M., Gueye, S.M., Watya, S., Signorello, L.B., Hayes, R.B., Wang, Z., Yeboah, E., Tettey, Y., Cai, Q., Kolb, S., Ostrander, E.A., Zeigler-Johnson, C., Yamamura, Y., Neslund-Dudas, C., Haslag-Minoff, J., Wu, W., Thomas, V., Allen, G.O., Murphy, A., Chang, B.-L., Zheng, S.L., Leske, M.C., Wu, S.-Y., Ray, A.M., Hennis, A.J.M., Thun, M.J., Carpten, J., Casey, G., Carter, E.N., Duarte, E.R., Xia, L.Y., Sheng, X., Wan, P., Pooler, L.C., Cheng, I., Monroe, K.R., Schumacher, F., Le Marchand, L., Kolonel, L.N., Chanock, S.J., Berg, D.V.D., Stram, D.O., Henderson, B.E.",Genome-wide association study of prostate cancer in men of African ancestry identifies a susceptibility locus at 17q21,2011,Nature Genetics,570,573,97
"Rafnar, T., Gudbjartsson, D.F., Sulem, P., Jonasdottir, A., Sigurdsson, A., Jonasdottir, A., Besenbacher, S., Lundin, P., Stacey, S.N., Gudmundsson, J., Magnusson, O.T., Le Roux, L., Orlygsdottir, G., Helgadottir, H.T., Johannsdottir, H., Gylfason, A., Tryggvadottir, L., Jonasson, J.G., De Juan, A., Ortega, E., Ramon-Cajal, J.M., García-Prats, M.D., Mayordomo, C., Panadero, A., Rivera, F., Aben, K.K.H., Van Altena, A.M., Massuger, L.F.A.G., Aavikko, M., Kujala, P.M., Staff, S., Aaltonen, L.A., Olafsdottir, K., Bjornsson, J., Kong, A., Salvarsdottir, A., Saemundsson, H., Olafsson, K., Benediktsdottir, K.R., Gulcher, J., Masson, G., Kiemeney, L.A., Mayordomo, J.I., Thorsteinsdottir, U., Stefansson, K.",Mutations in BRIP1 confer high risk of ovarian cancer,2011,Nature Genetics,1104,1107,97
"Brastianos, P.K., Horowitz, P.M., Santagata, S., Jones, R.T., Mckenna, A., Getz, G., Ligon, K.L., Palescandolo, E., Van Hummelen, P., Ducar, M.D., Raza, A., Sunkavalli, A., Macconaill, L.E., Stemmer-Rachamimov, A.O., Louis, D.N., Hahn, W.C., Dunn, I.F., Beroukhim, R.",Genomic sequencing of meningiomas identifies oncogenic SMO and AKT1 mutations,2013,Nature Genetics,285,289,97
"De Keersmaecker, K., Atak, Z.K., Li, N., Vicente, C., Patchett, S., Girardi, T., Gianfelici, V., Geerdens, E., Clappier, E., Porcu, M., Lahortiga, I., Lucà, R., Yan, J., Hulselmans, G., Vranckx, H., Vandepoel, R., Sweron, B., Jacobs, K., Mentens, N., Wlodarska, I., Cauwelier, B., Cloos, J., Soulier, J., Uyttebroeck, A., Bagni, C., Hassan, B.A., Vandenberghe, P., Johnson, A.W., Aerts, S., Cools, J.",Exome sequencing identifies mutation in CNOT3 and ribosomal genes RPL5 and RPL10 in T-cell acute lymphoblastic leukemia,2013,Nature Genetics,186,190,97
"Lesca, G., Rudolf, G., Bruneau, N., Lozovaya, N., Labalme, A., Boutry-Kryza, N., Salmi, M., Tsintsadze, T., Addis, L., Motte, J., Wright, S., Tsintsadze, V., Michel, A., Doummar, D., Lascelles, K., Strug, L., Waters, P., De Bellescize, J., Vrielynck, P., De Saint Martin, A., Ville, D., Ryvlin, P., Arzimanoglou, A., Hirsch, E., Vincent, A., Pal, D., Burnashev, N., Sanlaville, D., Szepetowski, P.",GRIN2A mutations in acquired epileptic aphasia and related childhood focal epilepsies and encephalopathies with speech and language dysfunction,2013,Nature Genetics,1061,1066,97
"Li, H., Peng, Z., Yang, X., Wang, W., Fu, J., Wang, J., Han, Y., Chai, Y., Guo, T., Yang, N., Liu, J., Warburton, M.L., Cheng, Y., Hao, X., Zhang, P., Zhao, J., Liu, Y., Wang, G., Li, J., Yan, J.",Genome-wide association study dissects the genetic architecture of oil biosynthesis in maize kernels,2013,Nature Genetics,43,50,97
"Schramke, V., Luciano, P., Brevet, V., Guillot, S., Corda, Y., Longhese, M.P., Gilson, E., Géli, V.",RPA regulates telomerase action by providing Est1p access to chromosome ends,2004,Nature Genetics,46,54,98
"Rokyta, D.R., Joyce, P., Caudle, S.B., Wichman, H.A.",An empirical test of the mutational landscape model of adaptation using a single-stranded DNA virus,2005,Nature Genetics,441,444,98
"Shi, S., Calhoun, H.C., Xia, F., Li, J., Le, L., Li, W.X.",JAK signaling globally counteracts heterochromatic gene silencing,2006,Nature Genetics,1071,1076,98
"Dong, P.D.S., Munson, C.A., Norton, W., Crosnier, C., Pan, X., Gong, Z., Neumann, C.J., Stainier, D.Y.R.",Fgf10 regulates hepatopancreatic ductal system patterning and differentiation,2007,Nature Genetics,397,402,98
"Sherborne, A.L., Hosking, F.J., Prasad, R.B., Kumar, R., Koehler, R., Vijayakrishnan, J., Papaemmanuil, E., Bartram, C.R., Stanulla, M., Schrappe, M., Gast, A., Dobbins, S.E., Ma, Y., Sheridan, E., Taylor, M., Kinsey, S.E., Lightfoot, T., Roman, E., Irving, J.A.E., Allan, J.M., Moorman, A.V., Harrison, C.J., Tomlinson, I.P., Richards, S., Zimmermann, M., Szalai, C., Semsei, A.F., Erdelyi, D.J., Krajinovic, M., Sinnett, D., Healy, J., Neira, A.G., Kawamata, N., Ogawa, S., Koeffler, H.P., Hemminki, K., Greaves, M., Houlston, R.S.",Variation in CDKN2A at 9p21.3 influences childhood acute lymphoblastic leukemia risk,2010,Nature Genetics,492,494,98
"Chu, X., Pan, C.-M., Zhao, S.-X., Liang, J., Gao, G.-Q., Zhang, X.-M., Yuan, G.-Y., Li, C.-G., Xue, L.-Q., Shen, M., Liu, W., Xie, F., Yang, S.-Y., Wang, H.-F., Shi, J.-Y., Sun, W.-W., Du, W.-H., Zuo, C.-L., Shi, J.-X., Liu, B.-L., Guo, C.-C., Zhan, M., Gu, Z.-H., Zhang, X.-N., Sun, F., Wang, Z.-Q., Song, Z.-Y., Zou, C.-Y., Sun, W.-H., Guo, T., Cao, H.-M., Ma, J.-H., Han, B., Li, P., Jiang, H., Huang, Q.-H., Liang, L., Liu, L.-B., Chen, G., Su, Q., Peng, Y.-D., Zhao, J.-J., Ning, G., Chen, Z., Chen, J.-L., Chen, S.-J., Huang, W., Song, H.-D.",A genome-wide association study identifies two new risk loci for Graves' disease,2011,Nature Genetics,897,901,98
"Gu, S.G., Pak, J., Guang, S., Maniar, J.M., Kennedy, S., Fire, A.",Amplification of siRNA in Caenorhabditis elegans generates a transgenerational sequence-targeted histone H3 lysine 9 methylation footprint,2012,Nature Genetics,157,164,98
"Bhende, P.M., Seaman, W.T., Delecluse, H.-J., Kenney, S.C.","The EBV lytic switch protein, Z, preferentially binds to and activates the methylated viral genome",2004,Nature Genetics,1099,1104,99
"Van Raamsdonk, C.D., Fitch, K.R., Fuchs, H., De Angelis, M.H., Barsh, G.S.",Effects of G-protein mutations on skin color,2004,Nature Genetics,961,968,99
"Toydemir, R.M., Rutherford, A., Whitby, F.G., Jorde, L.B., Carey, J.C., Bamshad, M.J.",Mutations in embryonic myosin heavy chain (MYH3) cause Freeman-Sheldon syndrome and Sheldon-Hall syndrome,2006,Nature Genetics,561,565,99
"Baala, L., Briault, S., Etchevers, H.C., Laumonnier, F., Natiq, A., Amiel, J., Boddaert, N., Picard, C., Sbiti, A., Asermouh, A., Attié-Bitach, T., Encha-Razavi, F., Munnich, A., Sefiani, A., Lyonnet, S.",Homozygous silencing of T-box transcription factor EOMES leads to microcephaly with polymicrogyria and corpus callosum agenesis,2007,Nature Genetics,454,456,99
"Wright, F.A., Strug, L.J., Doshi, V.K., Commander, C.W., Blackman, S.M., Sun, L., Berthiaume, Y., Cutler, D., Cojocaru, A., Collaco, J.M., Corey, M., Dorfman, R., Goddard, K., Green, D., Kent Jr., J.W., Lange, E.M., Lee, S., Li, W., Luo, J., Mayhew, G.M., Naughton, K.M., Pace, R.G., Paré, P., Rommens, J.M., Sandford, A., Stonebraker, J.R., Sun, W., Taylor, C., Vanscoy, L.L., Zou, F., Blangero, J., Zielenski, J., O'Neal, W.K., Drumm, M.L., Durie, P.R., Knowles, M.R., Cutting, G.R.",Genome-wide association and linkage identify modifier loci of lung disease severity in cystic fibrosis at 11p13 and 20q13.2,2011,Nature Genetics,539,546,99
"Wilder, J.A., Kingan, S.B., Mobasher, Z., Pilkington, M.M., Hammer, M.F.",Global patterns of human mitochondrial DNA and Y-chromosome structure are not influenced by higher migration rates of females versus males,2004,Nature Genetics,1122,1125,100
"Steidl, U., Rosenbauer, F., Verhaak, R.G.W., Gu, X., Ebralidze, A., Otu, H.H., Klippel, S., Steidl, C., Bruns, I., Costa, D.B., Wagner, K., Aivado, M., Kobbe, G., Valk, P.J.M., Passegué, E., Libermann, T.A., Delwel, R., Tenen, D.G.",Essential role of Jun family transcription factors in PU.1 knockdown-induced leukemic stem cells,2006,Nature Genetics,1269,1277,100
"Péterfy, M., Ben-Zeev, O., Mao, H.Z., Weissglas-Volkov, D., Aouizerat, B.E., Pullinger, C.R., Frost, P.H., Kane, J.P., Malloy, M.J., Reue, K., Pajukanta, P., Doolittle, M.H.",Mutations in LMF1 cause combined lipase deficiency and severe hypertriglyceridemia,2007,Nature Genetics,1483,1487,100
"Monti, J., Fischer, J., Paskas, S., Heinig, M., Schulz, H., Gösele, C., Heuser, A., Fischer, R., Schmidt, C., Schirdewan, A., Gross, V., Hummel, O., Maatz, H., Patone, G., Saar, K., Vingron, M., Weldon, S.M., Lindpaintner, K., Hammock, B.D., Rohde, K., Dietz, R., Cook, S.A., Schunck, W.-H., Luft, F.C., Hubner, N.",Soluble epoxide hydrolase is a susceptibility factor for heart failure in a rat model of human disease,2008,Nature Genetics,529,537,100
"Goriely, A., Hansen, R.M.S., Taylor, I.B., Olesen, I.A., Jacobsen, G.K., McGowan, S.J., Pfeifer, S.P., McVean, G.A.T., Meyts, E.R.-D., Wilkie, A.O.M.",Activating mutations in FGFR3 and HRAS reveal a shared genetic origin for congenital disorders and testicular tumors,2009,Nature Genetics,1247,1252,100
"Sanna, S., Pitzalis, M., Zoledziewska, M., Zara, I., Sidore, C., Murru, R., Whalen, M.B., Busonero, F., Maschio, A., Costa, G., Melis, M.C., Deidda, F., Poddie, F., Morelli, L., Farina, G., Li, Y., Dei, M., Lai, S., Mulas, A., Cuccuru, G., Porcu, E., Liang, L., Zavattari, P., Moi, L., Deriu, E., Urru, M.F., Bajorek, M., Satta, M.A., Cocco, E., Ferrigno, P., Sotgiu, S., Pugliatti, M., Traccis, S., Angius, A., Melis, M., Rosati, G., Abecasis, G.R., Uda, M., Marrosu, M.G., Schlessinger, D., Cucca, F.",Variants within the immunoregulatory CBLB gene are associated with multiple sclerosis,2010,Nature Genetics,495,497,100
