Authors,Title,Year,Source title,Cited by
"Chen Y., Popko B.",Cholesterol crystals impede nerve repair: Cholesterol deposits in phagocytic cells disrupt the repair of demyelinated axons,2018,Science,0
"Church S.H., Donoughe S., de Medeiros B.A.S., Extavour C.G.",Insect egg size and shape evolve with ecology but not developmental rate,2019,Nature,0
Coates M.,Plenty of fish in the tree,2017,Nature,0
Erwin D.H.,David M. Raup (1933-2015),2015,Nature,0
"Girard M., Wang S., Du J.S., Das A., Huang Z., Dravid V.P., Lee B., Mirkin C.A., de la Cruz M.O.",Particle analogs of electrons in colloidal crystals,2019,Science,0
Lederman L.,The pleasure of learning,2004,Nature,0
"Poeppel D., Brown M., Solomon S., Coyne J.A., Wang M.-W., Zittrain J., Zimmer C., Frankel F., Rienhoff H.Y., Hood B., Shubin N., Scott E., Knapp S., Kepecs A.",A break from the bench,2009,Nature,0
Rosner R.,Movers,2005,Nature,0
Ross L.F.,The safety dance,2015,Science,0
Shubin N.,Farish A. Jenkins Jr (1940-2012).,2012,Nature,0
"Bienfait A., Satzinger K.J., Zhong Y.P., Chang H.-S., Chou M.-H., Conner C.R., Dumur É., Grebel J., Peairs G.A., Povey R.G., Cleland A.N.",Phonon-mediated quantum state transfer and remote qubit entanglement,2019,Science,1
Coyne J.A.,Evolution. Ernst Mayr (1904-2005).,2005,Science,1
Coyne J.A.,Gould and God,2003,Nature,1
"Feng L., Hu J., Clark L.W., Chin C.",Correlations in high-harmonic generation of matter-wave jets revealed by pattern recognition,2019,Science,1
"Frank E.G., Wilcove D.S.",Long delays in banning trade in threatened species,2019,Science,1
Kadanoff L.P.,Kenneth geddes wilson (1936—2013),2013,Nature,1
"Mangravite L.M., Engelhardt B.E., Stephens M., Krauss R.M.",Mangravite et al. reply,2014,Nature,1
"Sikora M., Pitulko V.V., Sousa V.C., Allentoft M.E., Vinner L., Rasmussen S., Margaryan A., de Barros Damgaard P., de la Fuente C., Renaud G., Yang M.A., Fu Q., Dupanloup I., Giampoudakis K., Nogués-Bravo D., Rahbek C., Kroonen G., Peyrot M., McColl H., Vasilyev S.V., Veselovskaya E., Gerasimova M., Pavlova E.Y., Chasnyk V.G., Nikolskiy P.A., Gromov A.V., Khartanovich V.I., Moiseyev V., Grebenyuk P.S., Fedorchenko A.Y., Lebedintsev A.I., Slobodin S.B., Malyarchuk B.A., Martiniano R., Meldgaard M., Arppe L., Palo J.U., Sundell T., Mannermaa K., Putkonen M., Alexandersen V., Primeau C., Baimukhanov N., Malhi R.S., Sjögren K.-G., Kristiansen K., Wessman A., Sajantila A., Lahr M.M., Durbin R., Nielsen R., Meltzer D.J., Excoffier L., Willerslev E.",The population history of northeastern Siberia since the Pleistocene,2019,Nature,1
"Strober B.J., Elorbany R., Rhodes K., Krishnan N., Tayeb K., Battle A., Gilad Y.",Dynamic genetic regulation of gene expression during cellular differentiation,2019,Science,1
Turner M.,Cosmology: No miracle in the multiverse,2010,Nature,1
"Berkowitz T., Schaeffer M.W., Rozek C.S., Maloney E.A., Levine S.C., Beilock S.L.","Response to Comment on ""math at home adds up to achievement in school""",2016,Science,2
Buffett B.A.,Taking earth temperature,2007,Science,2
"Flannick J., Mercader J.M., Fuchsberger C., Udler M.S., Mahajan A., Wessel J., Teslovich T.M., Caulkins L., Koesterer R., Barajas-Olmos F., Blackwell T.W., Boerwinkle E., Brody J.A., Centeno-Cruz F., Chen L., Chen S., Contreras-Cubas C., Córdova E., Correa A., Cortes M., DeFronzo R.A., Dolan L., Drews K.L., Elliott A., Floyd J.S., Gabriel S., Garay-Sevilla M.E., García-Ortiz H., Gross M., Han S., Heard-Costa N.L., Jackson A.U., Jørgensen M.E., Kang H.M., Kelsey M., Kim B.-J., Koistinen H.A., Kuusisto J., Leader J.B., Linneberg A., Liu C.-T., Liu J., Lyssenko V., Manning A.K., Marcketta A., Malacara-Hernandez J.M., Martínez-Hernández A., Matsuo K., Mayer-Davis E., Mendoza-Caamal E., Mohlke K.L., Morrison A.C., Ndungu A., Ng M.C.Y., O’Dushlaine C., Payne A.J., Pihoker C., Post W.S., Preuss M., Psaty B.M., Vasan R.S., Rayner N.W., Reiner A.P., Revilla-Monsalve C., Robertson N.R., Santoro N., Schurmann C., So W.Y., Soberón X., Stringham H.M., Strom T.M., Tam C.H.T., Thameem F., Tomlinson B., Torres J.M., Tracy R.P., van Dam R.M., Vujkovic M., Wang S., Welch R.P., Witte D.R., Wong T.-Y., Atzmon G., Barzilai N., Blangero J., Bonnycastle L.L., Bowden D.W., Chambers J.C., Chan E., Cheng C.-Y., Cho Y.S., Collins F.S., de Vries P.S., Duggirala R., Glaser B., Gonzalez C., Gonzalez M.E., Groop L., Kooner J.S., Kwak S.H., Laakso M., Lehman D.M., Nilsson P., Spector T.D., Tai E.S., Tuomi T., Tuomilehto J., Wilson J.G., Aguilar-Salinas C.A., Bottinger E., Burke B., Carey D.J., Chan J.C.N., Dupuis J., Frossard P., Heckbert S.R., Hwang M.Y., Kim Y.J., Kirchner H.L., Lee J.-Y., Lee J., Loos R.J.F., Ma R.C.W., Morris A.D., O’Donnell C.J., Palmer C.N.A., Pankow J., Park K.S., Rasheed A., Saleheen D., Sim X., Small K.S., Teo Y.Y., Haiman C., Hanis C.L., Henderson B.E., Orozco L., Tusié-Luna T., Dewey F.E., Baras A., Gieger C., Meitinger T., Strauch K., Lange L., Grarup N., Hansen T., Pedersen O., Zeitler P., Dabelea D., Abecasis G., Bell G.I., Cox N.J., Seielstad M., Sladek R., Meigs J.B., Rich S.S., Rotter J.I., Altshuler D., Burtt N.P., Scott L.J., Morris A.P., Florez J.C., McCarthy M.I., Boehnke M., Broad Genomics Platform, DiscovEHR Collaboration, CHARGE, LuCamp, ProDiGY, GoT2D, ESP, SIGMA-T2D, T2D-GENES, AMP-T2D-GENES","Exome sequencing of 20,791 cases of type 2 diabetes and 24,440 controls",2019,Nature,2
"Gillingham K., Bushnell J., Fowlie M., Greenstone M., Kolstad C., Krupnick A., Morris A., Schmalensee R., Stock J.",Reforming the U.S. coal leasing program,2016,Science,2
Huber J.A.,Making methane down deep,2015,Science,2
Archer D.,Who Threw That Snowball?,2003,Science,3
"Dominguez Bello M.G., Knight R., Gilbert J.A., Blaser M.J.",Preserving microbial diversity: Microbiota from humans of all cultures are needed to ensure the health of future generations,2018,Science,3
"Jones K.E., Angielczyk K.D., Polly P.D., Head J.J., Fernandez V., Lungmus J.K., Tulga S., Pierce S.E.",Fossils reveal the complex evolutionary history of the mammalian regionalized spine,2018,Science,3
"Lee D., Chung B., Shi Y., Kim G.-Y., Campbell N., Xue F., Song K., Choi S.-Y., Podkaminer J.P., Kim T.H., Ryan P.J., Kim J.-W., Paudel T.R., Kang J.-H., Spinuzzi J.W., Tenne D.A., Tsymbal E.Y., Rzchowski M.S., Chen L.Q., Lee J., Eom C.B.",Isostructural metal-insulator transition in VO 2,2018,Science,3
Przeworski M.,Motivating hotspots,2005,Science,3
"Wible B., Azoulay P., Graff-Zivin J., Uzzi B., Wang D., Williams H., Evans J.A., Zhe Jin G., Feng Lu S., Jones B.F., Börner K., Lakhani K.R., Boudreau K.J., Guinan E.C.",Toward a more scientific science,2018,Science,3
"Buratti B.J., Thomas P.C., Roussos E., Howett C., Seiß M., Hendrix A.R., Helfenstein P., Brown R.H., Clark R.N., Denk T., Filacchione G., Hoffmann H., Jones G.H., Khawaja N., Kollmann P., Krupp N., Lunine J., Momary T.W., Paranicas C., Postberg F., Sachse M., Spahn F., Spencer J., Srama R., Albin T., Baines K.H., Ciarniello M., Economou T., Hsu H.-W., Kempf S., Krimigis S.M., Mitchell D., Moragas-Klostermeyer G., Nicholson P.D., Porco C.C., Rosenberg H., Simolka J., Soderblom L.A.","Close Cassini flybys of Saturn’s ring moons Pan, Daphnis, Atlas, Pandora, and Epimetheus",2019,Science,4
"Case L.B., Zhang X., Ditlev J.A., Rosen M.K.",Stoichiometry controls activity of phase-separated clusters of actin signaling proteins,2019,Science,4
Coyne J.A.,The self-centred meme,1999,Nature,4
"Faith J.T., Rowan J., Du A., Koch P.L.",Plio-Pleistocene decline of African megaherbivores: No evidence for ancient hominin impacts,2018,Science,4
Kronfeld A.S.,The weight of the world is quantum chromodynamics,2008,Science,4
Oka T.,Planet formation: Enigmatic emission,2002,Nature,4
"Pawar S., Dell A.I., Van M. Savage",Pawar et al. reply,2013,Nature,4
"Briscoe S.D., Ragsdale C.W.","Homology, neocortex, and the evolution of developmental mechanisms",2018,Science,5
Clayton R.N.,Meteorites and their parent asteroids,2006,Science,5
Dauphas N.,Sulphur from heaven and hell,2013,Nature,5
Gibson M.G.,Fate of Iraqi archaeology,2003,Science,5
"Hassan N., Cunningham S., Mourigal M., Zhilyaeva E.I., Torunova S.A., Lyubovskaya R.N., Schlueter J.A., Drichko N.",Evidence for a quantum dipole liquid state in an organic quasi-two-dimensional material,2018,Science,5
"Hochberg G.K.A., Shepherd D.A., Marklund E.G., Santhanagoplan I., Degiacomi M.T., Laganowsky A., Allison T.M., Basha E., Marty M.T., Galpin M.R., Struwe W.B., Baldwin A.J., Vierling E., Benesch J.L.P.",Structural principles that enable oligomeric small heat-shock protein paralogs to evolve distinct functions,2018,Science,5
Long M.,Journal club,2007,Nature,5
"Lopez S., Tejos N., Ledoux C., Felipe Barrientos L., Sharon K., Rigby J.R., Gladders M.D., Bayliss M.B., Pessa I.",A clumpy and anisotropic galaxy halo at redshift 1 from gravitational-Arc tomography,2018,Nature,5
"Mendoza J.L., Escalante N.K., Jude K.M., Sotolongo Bellon J., Su L., Horton T.M., Tsutsumi N., Berardinelli S.J., Haltiwanger R.S., Piehler J., Engleman E.G., Garcia K.C.",Structure of the IFNγ receptor complex guides design of biased agonists,2019,Nature,5
"Schine N., Chalupnik M., Can T., Gromov A., Simon J.",Electromagnetic and gravitational responses of photonic Landau levels,2019,Nature,5
Coyne J.A.,Switching on evolution,2005,Nature,6
"Karliner M., Rosner J.L.",Quark-level analogue of nuclear fusion with doubly heavy baryons,2017,Nature,6
"Li X., Bamba M., Yuan N., Zhang Q., Zhao Y., Xiang M., Xu K., Jin Z., Ren W., Ma G., Cao S., Turchinovich D., Kono J.",Observation of Dicke cooperativity in magnetic interactions,2018,Science,6
"Meselson M., Welch D.M.",Evolution: Stable heterozygosity?,2007,Science,6
"Nakamura N., Huang C.S.Y.",Atmospheric blocking as a traffic jam in the jet stream,2018,Science,6
"Cunningham R., Zhao C., Parab N., Kantzos C., Pauza J., Fezzaa K., Sun T., Rollett A.D.",Keyhole threshold and morphology in laser melting revealed by ultrahigh-speed x-ray imaging,2019,Science,7
"Agostini M., Altenmüller K., Appel S., Atroshchenko V., Bagdasarian Z., Basilico D., Bellini G., Benziger J., Bick D., Bonfini G., Bravo D., Caccianiga B., Calaprice F., Caminata A., Caprioli S., Carlini M., Cavalcante P., Chepurnov A., Choi K., Collica L., D’Angelo D., Davini S., Derbin A., Ding X.F., Di Ludovico A., Di Noto L., Drachnev I., Fomenko K., Formozov A., Franco D., Gabriele F., Galbiati C., Ghiano C., Giammarchi M., Goretti A., Gromov M., Guffanti D., Hagner C., Houdy T., Hungerford E., Ianni A., Ianni A., Jany A., Jeschke D., Kobychev V., Korablev D., Korga G., Kryn D., Laubenstein M., Litvinovich E., Lombardi F., Lombardi P., Ludhova L., Lukyanchenko G., Lukyanchenko L., Machulin I., Manuzio G., Marcocci S., Martyn J., Meroni E., Meyer M., Miramonti L., Misiaszek M., Muratova V., Neumair B., Oberauer L., Opitz B., Orekhov V., Ortica F., Pallavicini M., Papp L., Penek Ö., Pilipenko N., Pocar A., Porcelli A., Raikov G., Ranucci G., Razeto A., Re A., Redchuk M., Romani A., Roncin R., Rossi N., Schönert S., Semenov D., Skorokhvatov M., Smirnov O., Sotnikov A., Stokes L.F.F., Suvorov Y., Tartaglia R., Testera G., Thurn J., Toropova M., Unzhakov E., Villante F.L., Vishneva A., Vogelaar R.B., von Feilitzsch F., Wang H., Weinz S., Wojcik M., Wurm M., Yokley Z., Zaimidoroga O., Zavatarelli S., Zuber K., Zuzel G., The Borexino Collaboration",Comprehensive measurement of pp-chain solar neutrinos,2018,Nature,8
"Chiara C.J., Carroll J.J., Carpenter M.P., Greene J.P., Hartley D.J., Janssens R.V.F., Lane G.J., Marsh J.C., Matters D.A., Polasik M., Rzadkiewicz J., Seweryniak D., Zhu S., Bottoni S., Hayes A.B.",Isomer depletion as experimental evidence of nuclear excitation by electron capture,2018,Nature,8
"Hoshika S., Leal N.A., Kim M.-J., Kim M.-S., Karalkar N.B., Kim H.-J., Bates A.M., Watkins N.E., Jr., SantaLucia H.A., Meyer A.J., DasGupta S., Piccirilli J.A., Ellington A.D., SantaLucia J., Jr., Georgiadis M.M., Benner S.A.",Hachimoji DNA and RNA: A genetic system with eight building blocks,2019,Science,8
"Littman D.R., Singh H.",Asymmetry and immune memory,2007,Science,8
Norman M.,Have Cuprates Earned Their Stripes?,2004,Science,8
"Riback J.A., Bowman M.A., Zmyslowski A., Knoverek C.R., Jumper J., Kaye E.B., Freed K.F., Clark P.L., Sosnick T.R.",Response to comment on “Innovative scattering analysis shows that hydrophobic disordered proteins are expanded in water”,2018,Science,8
"Tian H., Melillo J.M., Kicklighter D.W., Mc Guire A.D., Moore B., Vörösmarty C.J.",Reply: Parameters for global ecosystem models,1999,Nature,8
"Yu J., Jackson N.E., Xu X., Morgenstern Y., Kaufman Y., Ruths M., de Pablo J.J., Tirrell M.",Multivalent counterions diminish the lubricity of polyelectrolyte brushes,2018,Science,8
"Adriani A., Mura A., Orton G., Hansen C., Altieri F., Moriconi M.L., Rogers J., Eichstädt G., Momary T., Ingersoll A.P., Filacchione G., Sindoni G., Tabataba-Vakili F., Dinelli B.M., Fabiano F., Bolton S.J., Connerney J.E.P., Atreya S.K., Lunine J.I., Tosi F., Migliorini A., Grassi D., Piccioni G., Noschese R., Cicchetti A., Plainaki C., Olivieri A., O'Neill M.E., Turrini D., Stefani S., Sordini R., Amoroso M.",Clusters of cyclones encircling Jupiter's poles,2018,Nature,10
"Correa-Baena J.-P., Luo Y., Brenner T.M., Snaider J., Sun S., Li X., Jensen M.A., Hartono N.T.P., Nienhaus L., Wieghold S., Poindexter J.R., Wang S., Meng Y.S., Wang T., Lai B., Holt M.V., Cai Z., Bawendi M.G., Huang L., Buonassisi T., Fenning D.P.",Homogenized halides and alkali cation segregation in alloyed organic-inorganic perovskites,2019,Science,10
"Goremychkin E.A., Park H., Osborn R., Rosenkranz S., Castellan J.-P., Fanelli V.R., Christianson A.D., Stone M.B., Bauer E.D., McClellan K.J., Byler D.D., Lawrence J.M.",Coherent band excitations in CePd3: A comparison of neutron scattering and ab initio theory,2018,Science,10
"Ma R., Saxberg B., Owens C., Leung N., Lu Y., Simon J., Schuster D.I.",A dissipatively stabilized Mott insulator of photons,2019,Nature,10
"Radovic A., Williams M., Rousseau D., Kagan M., Bonacorsi D., Himmel A., Aurisano A., Terao K., Wongjirad T.",Machine learning at the energy and intensity frontiers of particle physics,2018,Nature,11
"Sosnick T.R., Hinshaw J.R.",How proteins fold,2011,Science,11
"Bergemann M., Sesar B., Cohen J.G., Serenelli A.M., Sheffield A., Li T.S., Casagrande L., Johnston K.V., Laporte C.F.P., Price-Whelan A.M., Schönrich R., Gould A.",Two chemically similar stellar overdensities on opposite sides of the plane of the Galactic disk,2018,Nature,12
"Azevedo E.M., Weyl E.G.",Matching markets in the digital age,2016,Science,13
"Chen P., Tao L., Wang T., Zhang J., He A., Lam K.-H., Liu Z., He X., Perry K., Dong M., Jin R.",Structural basis for recognition of frizzled proteins by clostridium difficile toxin B,2018,Science,13
"Chong L., Wen J., Kubal J., Sen F.G., Zou J., Greeley J., Chan M., Barkholtz H., Ding W., Liu D.-J.",Ultralow-loading platinum-cobalt fuel cell catalysts derived from imidazolate frameworks,2018,Science,13
"Clark L.W., Gaj A., Feng L., Chin C.",Collective emission of matter-wave jets from driven Bose-Einstein condensates,2017,Nature,13
"Llopart A., Elwyn S., Coyne J.A.",Fruitflies: Pigmentation and mate choice in Drosophila,2002,Nature,13
"Coates M.I., Gess R.W., Finarelli J.A., Criswell K.E., Tietjen K.",A symmoriiform chondrichthyan braincase and the origin of chimaeroid fishes,2017,Nature,14
"de Barros Damgaard P., Martiniano R., Kamm J., Víctor Moreno-Mayar J., Kroonen G., Peyrot M., Barjamovic G., Rasmussen S., Zacho C., Baimukhanov N., Zaibert V., Merz V., Biddanda A., Merz I., Loman V., Evdokimov V., Usmanova E., Hemphill B., Seguin-Orlando A., Yediay F.E., Ullah I., Sjögren K.-G., Iversen K.H., Choin J., de la Fuente C., Ilardo M., Schroeder H., Moiseyev V., Gromov A., Polyakov A., Omura S., Senyurt S.Y., Ahmad H., McKenzie C., Margaryan A., Hameed A., Samad A., Gul N., Khokhar M.H., Goriunova O.I., Bazaliiskii V.I., Novembre J., Weber A.W., Orlando L., Allentoft M.E., Nielsen R., Kristiansen K., Sikora M., Outram A.K., Durbin R., Willerslev E.",The first horse herders and the impact of early Bronze Age steppe expansions into Asia,2018,Science,14
"Li C., De Grijs R., Deng L., Geller A.M., Xin Y., Hu Y., Faucher-Giguère C.-A.",Formation of new stellar populations from gas accreted by massive young star clusters,2016,Nature,14
"McCoy V.E., Saupe E.E., Lamsdell J.C., Tarhan L.G., McMahon S., Lidgard S., Mayer P., Whalen C.D., Soriano C., Finney L., Vogt S., Clark E.G., Anderson R.P., Petermann H., Locatelli E.R., Briggs D.E.G.",The 'Tully monster' is a vertebrate,2016,Nature,14
Grier D.G.,Vortex rings in a constant electric field,2003,Nature,15
"Yao H., Price T.T., Cantelli G., Ngo B., Warner M.J., Olivere L., Ridge S.M., Jablonski E.M., Therrien J., Tannheimer S., McCall C.M., Chenn A., Sipkins D.A.",Leukaemia hijacks a neural mechanism to invade the central nervous system,2018,Nature,15
"Fowlie M., Goulder L., Kotchen M., Borenstein S., Bushnell J., Davis L., Greenstone M., Kolstad C., Knittel C., Stavins R., Wara M., Wolak F., Wolfram C.",An economic perspective on the EPA's clean power plan,2014,Science,16
"Lavoie H., Sahmi M., Maisonneuve P., Marullo S.A., Thevakumaran N., Jin T., Kurinov I., Sicheri F., Therrien M.",MEK drives BRAF activation through allosteric control of KSR proteins,2018,Nature,16
"Meisel M., Hinterleitner R., Pacis A., Chen L., Earley Z.M., Mayassi T., Pierre J.F., Ernest J.D., Galipeau H.J., Thuille N., Bouziat R., Buscarlet M., Ringus D.L., Wang Y., Li Y., DInh V., Kim S.M., McDonald B.D., Zurenski M.A., Musch M.W., Furtado G.C., Lira S.A., Baier G., Chang E.B., Eren A.M., Weber C.R., Busque L., Godley L.A., Verdú E.F., Barreiro L.B., Jabri B.",Microbial signals drive pre-leukaemic myeloproliferation in a Tet2-deficient host,2018,Nature,16
"Tippett M.K., Lepore C., Cohen J.E.",More tornadoes in the most extreme U.S. tornado outbreaks,2016,Science,16
"Wachter S., Ramirez-Ruiz E., Dwarkadas V.V., Kouveliotou C., Granot J., Patel S.K., Figer D.",An infrared ring around the magnetar SGR 1900+14,2008,Nature,16
"Yan H., Yang F., Pan D., Lin Y., Hohman J.N., Solis-Ibarra D., Li F.H., Dahl J.E.P., Carlson R.M.K., Tkachenko B.A., Fokin A.A., Schreiner P.R., Galli G., Mao W.L., Shen Z.X., Melosh N.A.",Sterically controlled mechanochemistry under hydrostatic pressure,2018,Nature,16
"Bindeman I.N., Zakharov D.O., Palandri J., Greber N.D., Dauphas N., Retallack G.J., Hofmann A., Lackey J.S., Bekker A.",Rapid emergence of subaerial landmasses and onset of a modern hydrologic cycle 2.5 billion years ago,2018,Nature,17
Greeley J.P.,Active site of an industrial catalyst,2012,Science,17
"Meng Q.-J., Grossnickle D.M., Liu D., Zhang Y.-G., Neander A.I., Ji Q., Luo Z.-X.",New gliding mammaliaforms from the Jurassic,2017,Nature,17
"Scheeler M.W., Van Rees W.M., Kedia H., Kleckner D., Irvine W.T.M.",Complete measurement of helicity and its dynamics in vortex tubes,2017,Science,17
"Chong F.T., Franklin D., Martonosi M.",Programming languages and compiler design for realistic quantum hardware,2017,Nature,18
"Fan C., Fan M., Orlando B.J., Fastman N.M., Zhang J., Xu Y., Chambers M.G., Xu X., Perry K., Liao M., Feng L.",X-ray and cryo-EM structures of the mitochondrial calcium uniporter,2018,Nature,18
"Klomp J., Athy D., Kwan C.W., Bloch N.I., Sandmann T., Lemke S., Schmidt-Ott U.",A cysteine-clamp gene drives embryo polarity in the midge Chironomus,2015,Science,19
"Liang Q.-Y., Venkatramani A.V., Cantu S.H., Nicholson T.L., Gullans M.J., Gorshkov A.V., Thompson J.D., Chin C., Lukin M.D., Vuletić V.",Observation of three-photon bound States in a quantum nonlinear medium,2018,Science,19
"Luo Z.-X., Meng Q.-J., Grossnickle D.M., Liu D., Neander A.I., Zhang Y.-G., Ji Q.",New evidence for mammaliaform ear evolution and feeding adaptation in a Jurassic ecosystem,2017,Nature,20
"Zhang D., Tu S., Stubna M., Wu W.-S., Huang W.-C., Weng Z., Lee H.-C.",The piRNA targeting rules and the resistance to piRNA silencing in endogenous genes,2018,Science,20
"Frye M., Harada B.T., Behm M., He C.",RNA modifications modulate gene expression during development,2018,Science,21
"Heisler D.B., Kudryashova E., Grinevich D.O., Suarez C., Winkelman J.D., Birukov K.G., Kotha S.R., Parinandi N.L., Vavylonis D., Kovar D.R., Kudryashov D.S.",ACD toxin-produced actin oligomers poison formin-controlled actin polymerization,2015,Science,21
"Hoekstra H.E., Price T.",Parallel Evolution Is in the Genes,2004,Science,21
"Poccia N., Baturina T.I., Coneri F., Molenaar C.G., Wang X.R., Bianconi G., Brinkman A., Hilgenkamp H., Golubov A.A., Vinokur V.M.",Critical behavior at a dynamic vortex insulator-to-metal transition,2015,Science,21
"Rana M.S., Kumar P., Lee C.-J., Verardi R., Rajashankar K.R., Banerjee A.",Fatty acyl recognition and transfer by an integral membrane S-acyltransferase,2018,Science,21
"Laanait N., Callagon E.B.R., Zhang Z., Sturchio N.C., Lee S.S., Fenter P.",X-ray-driven reaction front dynamics at calcite-water interfaces,2015,Science,22
"Marrone D.P., Spilker J.S., Hayward C.C., Vieira J.D., Aravena M., Ashby M.L.N., Bayliss M.B., Béthermin M., Brodwin M., Bothwell M.S., Carlstrom J.E., Chapman S.C., Chen C.-C., Crawford T.M., Cunningham D.J.M., De Breuck C., Fassnacht C.D., Gonzalez A.H., Greve T.R., Hezaveh Y.D., Lacaille K., Litke K.C., Lower S., Ma J., Malkan M., Miller T.B., Morningstar W.R., Murphy E.J., Narayanan D., Phadke K.A., Rotermund K.M., Sreevani J., Stalder B., Stark A.A., Strandet M.L., Tang M., Weiß A.",Galaxy growth in a massive halo in the first billion years of cosmic history,2018,Nature,22
"Martin T., Marugán-Lobón J., Vullo R., Martín-Abad H., Luo Z.-X., Buscalioni A.D.",A Cretaceous eutriconodont and integument evolution in early mammals,2015,Nature,22
"Tschauner O., Huang S., Greenberg E., Prakapenka V.B., Ma C., Rossman G.R., Shen A.H., Zhang D., Newville M., Lanzirotti A., Tait K.",Ice-VII inclusions in diamonds: Evidence for aqueous fluid in Earth’s deep mantle,2018,Science,22
"Zhang Z., Schwanz D., Narayanan B., Kotiuga M., Dura J.A., Cherukara M., Zhou H., Freeland J.W., Li J., Sutarto R., He F., Wu C., Zhu J., Sun Y., Ramadoss K., Nonnenmann S.S., Yu N., Comin R., Rabe K.M., Sankaranarayanan S.K.R.S., Ramanathan S.",Perovskite nickelates as electric-field sensors in salt water,2018,Nature,22
Carroll S.M.,Is our Universe natural?,2006,Nature,23
"Fricke H.C., Hencecroth J., Hoerner M.E.",Lowland-upland migration of sauropod dinosaurs during the Late Jurassic epoch,2011,Nature,23
"Li L., Connors M.J., Kolle M., England G.T., Speiser D.I., Xiao X., Aizenberg J., Ortiz C.",Multifunctionality of chiton biomineralized armor with an integrated visual system,2015,Science,23
"Liu J., Hu Q., Young Kim D., Wu Z., Wang W., Xiao Y., Chow P., Meng Y., Prakapenka V.B., Mao H.-K., Mao W.L.",Hydrogen-bearing iron peroxide and the origin of ultralow-velocity zones,2017,Nature,23
"Plata G., Henry C.S., Vitkup D.",Long-term phenotypic evolution of bacteria,2015,Nature,24
Jablonski D.,Extinction: Past and present,2004,Nature,26
"Wu L., Willis J.J., McKay I.S., Diroll B.T., Qin J., Cargnello M., Tassone C.J.",High-temperature crystallization of nanocrystals into three-dimensional superlattices,2017,Nature,26
"Krauss L.M., Dodelson S., Meyer S.",Primordial gravitational waves and cosmology,2010,Science,27
"Starr T.N., Picton L.K., Thornton J.W.",Alternative evolutionary histories in the sequence space of an ancient protein,2017,Nature,27
"Wang D., Liu S., Warrell J., Won H., Shi X., Navarro F.C.P., Clarke D., Gu M., Emani P., Yang Y.T., Min X., Gandal M.J., Lou S., Zhang J., Park J.J., Yan C., KyongRhie S., Manakongtreecheep K., Zhou H., Aparna Natha A., Peters M., Mattei E., Fitzgerald D., Brunetti T., Moore J., Jiang Y., Girdhar K., Hoffman G.E., Kalayci S., Gümüş Z.H., Crawford G.E., Roussos P., Akbarian S., Jaffe A.E., White K.P., Weng Z., Sestan N., Geschwind D.H., Knowles J.A., Gerstein M.B.",Comprehensive functional genomic resource and integrative model for the human brain,2018,Science,27
"Yau A., Cha W., Kanan M.W., Stephenson G.B., Ulvestad A.",Materials science: Bragg coherent diffractive imaging of single-grain defect dynamics in polycrystalline films,2017,Science,27
