Authors,Title,Year,Source title,Cited by
"Abbott B.P., Abbott R., Abbott T.D., Acernese F., Ackley K., Adams C., Adams T., Addesso P., Adhikari R.X., Adya V.B., Affeldt C., Afrough M., Agarwal B., Agathos M., Agatsuma K., Aggarwal N., Aguiar O.D., Aiello L., Ain A., Ajith P., Allen B., Allen G., Allocca A., Altin P.A., Amato A., Ananyeva A., Anderson S.B., Anderson W.G., Angelova S.V., Antier S., Appert S., Arai K., Araya M.C., Areeda J.S., Arnaud N., Arun K.G., Ascenzi S., Ashton G., Ast M., Aston S.M., Astone P., Atallah D.V., Aufmuth P., Aulbert C., AultONeal K., Austin C., Avila-Alvarez A., Babak S., Bacon P., Bader M.K.M., Bae S., Baker P.T., Baldaccini F., Ballardin G., Ballmer S.W., Banagiri S., Barayoga J.C., Barclay S.E., Barish B.C., Barker D., Barkett K., Barone F., Barr B., Barsotti L., Barsuglia M., Barta D., Bartlett J., Bartos I., Bassiri R., Basti A., Batch J.C., Bawaj M., Bayley J.C., Bazzan M., Bécsy B., Beer C., Bejger M., Belahcene I., Bell A.S., Berger B.K., Bergmann G., Bero J.J., Berry C.P.L., Bersanetti D., Bertolini A., Betzwieser J., Bhagwat S., Bhandare R., Bilenko I.A., Billingsley G., Billman C.R., Birch J., Birney R., Birnholtz O., Biscans S., Biscoveanu S., Bisht A., Bitossi M., Biwer C., Bizouard M.A., Blackburn J.K., Blackman J., Blair C.D., Blair D.G., Blair R.M., Bloemen S., Bock O., Bode N., Boer M., Bogaert G., Bohe A., Bondu F., Bonilla E., Bonnand R., Boom B.A., Bork R., Boschi V., Bose S., Bossie K., Bouffanais Y., Bozzi A., Bradaschia C., Brady P.R., Branchesi M., Brau J.E., Briant T., Brillet A., Brinkmann M., Brisson V., Brockill P., Broida J.E., Brooks A.F., Brown D.A., Brown D.D., Brunett S., Buchanan C.C., Buikema A., Bulik T., Bulten H.J., Buonanno A., Buskulic D., Buy C., Byer R.L., Cabero M., Cadonati L., Cagnoli G., Cahillane C., Calderón Bustillo J., Callister T.A., Calloni E., Camp J.B., Canepa M., Canizares P., Cannon K.C., Cao H., Cao J., Capano C.D., Capocasa E., Carbognani F., Caride S., Carney M.F., Casanueva Diaz J., Casentini C., Caudill S., Cavaglià M., Cavalier F., Cavalieri R., Cella G., Cepeda C.B., Cerdá-Durán P., Cerretani G., Cesarini E., Chamberlin S.J., Chan M., Chao S., Charlton P., Chase E., Chassande-Mottin E., Chatterjee D., Chatziioannou K., Cheeseboro B.D., Chen H.Y., Chen X., Chen Y., Cheng H.-P., Chia H., Chincarini A., Chiummo A., Chmiel T., Cho H.S., Cho M., Chow J.H., Christensen N., Chu Q., Chua A.J.K., Chua S., Chung A.K.W., Chung S., Ciani G., Ciolfi R., Cirelli C.E., Cirone A., Clara F., Clark J.A., Clearwater P., Cleva F., Cocchieri C., Coccia E., Cohadon P.-F., Cohen D., Colla A., Collette C.G., Cominsky L.R., Constancio M., Jr., Conti L., Cooper S.J., Corban P., Corbitt T.R., Cordero-Carrión I., Corley K.R., Cornish N., Corsi A., Cortese S., Costa C.A., Coughlin M.W., Coughlin S.B., Coulon J.-P., Countryman S.T., Couvares P., Covas P.B., Cowan E.E., Coward D.M., Cowart M.J., Coyne D.C., Coyne R., Creighton J.D.E., Creighton T.D., Cripe J., Crowder S.G., Cullen T.J., Cumming A., Cunningham L., Cuoco E., Dal Canton T., Dálya G., Danilishin S.L., D'Antonio S., Danzmann K., Dasgupta A., Da Silva Costa C.F., Datrier L.E.H., Dattilo V., Dave I., Davier M., Davis D., Daw E.J., Day B., De S., DeBra D., Degallaix J., De Laurentis M., Deléglise S., Del Pozzo W., Demos N., Denker T., Dent T., De Pietri R., Dergachev V., De Rosa R., DeRosa R.T., De Rossi C., DeSalvo R., De Varona O., Devenson J., Dhurandhar S., Díaz M.C., Di Fiore L., Di Giovanni M., Di Girolamo T., Di Lieto A., Di Pace S., Di Palma I., Di Renzo F., Doctor Z., Dolique V., Donovan F., Dooley K.L., Doravari S., Dorrington I., Douglas R., Dovale Álvarez M., Downes T.P., Drago M., Dreissigacker C., Driggers J.C., Du Z., Ducrot M., Dupej P., Dwyer S.E., Edo T.B., Edwards M.C., Effler A., Eggenstein H.-B., Ehrens P., Eichholz J., Eikenberry S.S., Eisenstein R.A., Essick R.C., Estevez D., Etienne Z.B., Etzel T., Evans M., Evans T.M., Factourovich M., Fafone V., Fair H., Fairhurst S., Fan X., Farinon S., Farr B., Farr W.M., Fauchon-Jones E.J., Favata M., Fays M., Fee C., Fehrmann H., Feicht J., Fejer M.M., Fernandez-Galiana A., Ferrante I., Ferreira E.C., Ferrini F., Fidecaro F., Finstad D., Fiori I., Fiorucci D., Fishbach M., Fisher R.P., Fitz-Axen M., Flaminio R., Fletcher M., Fong H., Font J.A., Forsyth P.W.F., Forsyth S.S., Fournier J.-D., Frasca S., Frasconi F., Frei Z., Freise A., Frey R., Frey V., Fries E.M., Fritschel P., Frolov V.V., Fulda P., Fyffe M., Gabbard H., Gadre B.U., Gaebel S.M., Gair J.R., Gammaitoni L., Ganija M.R., Gaonkar S.G., Garcia-Quiros C., Garufi F., Gateley B., Gaudio S., Gaur G., Gayathri V., Gehrels N., Gemme G., Genin E., Gennai A., George D., George J., Gergely L., Germain V., Ghonge S., Ghosh A., Ghosh A., Ghosh S., Giaime J.A., Giardina K.D., Giazotto A., Gill K., Glover L., Goetz E., Goetz R., Gomes S., Goncharov B., González G., Gonzalez Castro J.M., Gopakumar A., Gorodetsky M.L., Gossan S.E., Gosselin M., Gouaty R., Grado A., Graef C., Granata M., Grant A., Gras S., Gray C., Greco G., Green A.C., Gretarsson E.M., Groot P., Grote H., Grunewald S., Gruning P., Guidi G.M., Guo X., Gupta A., Gupta M.K., Gushwa K.E., Gustafson E.K., Gustafson R., Halim O., Hall B.R., Hall E.D., Hamilton E.Z., Hammond G., Haney M., Hanke M.M., Hanks J., Hanna C., Hannam M.D., Hannuksela O.A., Hanson J., Hardwick T., Harms J., Harry G.M., Harry I.W., Hart M.J., Haster C.-J., Haughian K., Healy J., Heidmann A., Heintze M.C., Heitmann H., Hello P., Hemming G., Hendry M., Heng I.S., Hennig J., Heptonstall A.W., Heurs M., Hild S., Hinderer T., Hoak D., Hofman D., Holt K., Holz D.E., Hopkins P., Horst C., Hough J., Houston E.A., Howell E.J., Hreibi A., Hu Y.M., Huerta E.A., Huet D., Hughey B., Husa S., Huttner S.H., Huynh-Dinh T., Indik N., Inta R., Intini G., Isa H.N., Isac J.-M., Isi M., Iyer B.R., Izumi K., Jacqmin T., Jani K., Jaranowski P., Jawahar S., Jiménez-Forteza F., Johnson W.W., Jones D.I., Jones R., Jonker R.J.G., Ju L., Junker J., Kalaghatgi C.V., Kalogera V., Kamai B., Kandhasamy S., Kang G., Kanner J.B., Kapadia S.J., Karki S., Karvinen K.S., Kasprzack M., Katolik M., Katsavounidis E., Katzman W., Kaufer S., Kawabe K., Kéfélian F., Keitel D., Kemball A.J., Kennedy R., Kent C., Key J.S., Khalili F.Y., Khan I., Khan S., Khan Z., Khazanov E.A., Kijbunchoo N., Kim C., Kim J.C., Kim K., Kim W., Kim W.S., Kim Y.-M., Kimbrell S.J., King E.J., King P.J., Kinley-Hanlon M., Kirchhoff R., Kissel J.S., Kleybolte L., Klimenko S., Knowles T.D., Koch P., Koehlenbeck S.M., Koley S., Kondrashov V., Kontos A., Korobko M., Korth W.Z., Kowalska I., Kozak D.B., Krämer C., Kringel V., Krishnan B., Królak A., Kuehn G., Kumar P., Kumar R., Kumar S., Kuo L., Kutynia A., Kwang S., Lackey B.D., Lai K.H., Landry M., Lang R.N., Lange J., Lantz B., Lanza R.K., Lartaux-Vollard A., Lasky P.D., Laxen M., Lazzarini A., Lazzaro C., Leaci P., Leavey S., Lee C.H., Lee H.K., Lee H.M., Lee H.W., Lee K., Lehmann J., Lenon A., Leonardi M., Leroy N., Letendre N., Levin Y., Li T.G.F., Linker S.D., Littenberg T.B., Liu J., Liu X., Lo R.K.L., Lockerbie N.A., London L.T., Lord J.E., Lorenzini M., Loriette V., Lormand M., Losurdo G., Lough J.D., Lousto C.O., Lovelace G., Lück H., Lumaca D., Lundgren A.P., Lynch R., Ma Y., Macas R., Macfoy S., Machenschalk B., MacInnis M., Macleod D.M., Magaña Hernandez I., Magaña-Sandoval F., Magaña Zertuche L., Magee R.M., Majorana E., Maksimovic I., Man N., Mandic V., Mangano V., Mansell G.L., Manske M., Mantovani M., Marchesoni F., Marion F., Márka S., Márka Z., Markakis C., Markosyan A.S., Markowitz A., Maros E., Marquina A., Martelli F., Martellini L., Martin I.W., Martin R.M., Martynov D.V., Mason K., Massera E., Masserot A., Massinger T.J., Masso-Reid M., Mastrogiovanni S., Matas A., Matichard F., Matone L., Mavalvala N., Mazumder N., McCarthy R., McClelland D.E., McCormick S., McCuller L., McGuire S.C., McIntyre G., McIver J., McManus D.J., McNeill L., McRae T., McWilliams S.T., Meacher D., Meadors G.D., Mehmet M., Meidam J., Mejuto-Villa E., Melatos A., Mendell G., Mercer R.A., Merilh E.L., Merzougui M., Meshkov S., Messenger C., Messick C., Metzdorff R., Meyers P.M., Miao H., Michel C., Middleton H., Mikhailov E.E., Milano L., Miller A.L., Miller B.B., Miller J., Millhouse M., Milovich-Goff M.C., Minazzoli O., Minenkov Y., Ming J., Mishra C., Mitra S., Mitrofanov V.P., Mitselmakher G., Mittleman R., Moffa D., Moggi A., Mogushi K., Mohan M., Mohapatra S.R.P., Montani M., Moore C.J., Moraru D., Moreno G., Morriss S.R., Mours B., Mow-Lowry C.M., Mueller G., Muir A.W., Mukherjee A., Mukherjee D., Mukherjee S., Mukund N., Mullavey A., Munch J., Muñiz E.A., Muratore M., Murray P.G., Napier K., Nardecchia I., Naticchioni L., Nayak R.K., Neilson J., Nelemans G., Nelson T.J.N., Nery M., Neunzert A., Nevin L., Newport J.M., Newton G., Ng K.K.Y., Nguyen T.T., Nichols D., Nielsen A.B., Nissanke S., Nitz A., Noack A., Nocera F., Nolting D., North C., Nuttall L.K., Oberling J., O'Dea G.D., Ogin G.H., Oh J.J., Oh S.H., Ohme F., Okada M.A., Oliver M., Oppermann P., Oram R.J., O'Reilly B., Ormiston R., Ortega L.F., O'Shaughnessy R., Ossokine S., Ottaway D.J., Overmier H., Owen B.J., Pace A.E., Page J., Page M.A., Pai A., Pai S.A., Palamos J.R., Palashov O., Palomba C., Pal-Singh A., Pan H., Pan H.-W., Pang B., Pang P.T.H., Pankow C., Pannarale F., Pant B.C., Paoletti F., Paoli A., Papa M.A., Parida A., Parker W., Pascucci D., Pasqualetti A., Passaquieti R., Passuello D., Patil M., Patricelli B., Pearlstone B.L., Pedraza M., Pedurand R., Pekowsky L., Pele A., Penn S., Perez C.J., Perreca A., Perri L.M., Pfeiffer H.P., Phelps M., Piccinni O.J., Pichot M., Piergiovanni F., Pierro V., Pillant G., Pinard L., Pinto I.M., Pirello M., Pitkin M., Poe M., Poggiani R., Popolizio P., Porter E.K., Post A., Powell J., Prasad J., Pratt J.W.W., Pratten G., Predoi V., Prestegard T., Prijatelj M., Principe M., Privitera S., Prodi G.A., Prokhorov L.G., Puncken O., Punturo M., Puppo P., Pürrer M., Qi H., Quetschke V., Quintero E.A., Quitzow-James R., Raab F.J., Rabeling D.S., Radkins H., Raffai P., Raja S., Rajan C., Rajbhandari B., Rakhmanov M., Ramirez K.E., Ramos-Buades A., Rapagnani P., Raymond V., Razzano M., Read J., Regimbau T., Rei L., Reid S., Reitze D.H., Ren W., Reyes S.D., Ricci F., Ricker P.M., Rieger S., Riles K., Rizzo M., Robertson N.A., Robie R., Robinet F., Rocchi A., Rolland L., Rollins J.G., Roma V.J., Romano J.D., Romano R., Romel C.L., Romie J.H., Rosińska D., Ross M.P., Rowan S., Rüdiger A., Ruggi P., Rutins G., Ryan K., Sachdev S., Sadecki T., Sadeghian L., Sakellariadou M., Salconi L., Saleem M., Salemi F., Samajdar A., Sammut L., Sampson L.M., Sanchez E.J., Sanchez L.E., Sanchis-Gual N., Sandberg V., Sanders J.R., Sassolas B., Sathyaprakash B.S., Saulson P.R., Sauter O., Savage R.L., Sawadsky A., Schale P., Scheel M., Scheuer J., Schmidt J., Schmidt P., Schnabel R., Schofield R.M.S., Schönbeck A., Schreiber E., Schuette D., Schulte B.W., Schutz B.F., Schwalbe S.G., Scott J., Scott S.M., Seidel E., Sellers D., Sengupta A.S., Sentenac D., Sequino V., Sergeev A., Shaddock D.A., Shaffer T.J., Shah A.A., Shahriar M.S., Shaner M.B., Shao L., Shapiro B., Shawhan P., Sheperd A., Shoemaker D.H., Shoemaker D.M., Siellez K., Siemens X., Sieniawska M., Sigg D., Silva A.D., Singer L.P., Singh A., Singhal A., Sintes A.M., Slagmolen B.J.J., Smith B., Smith J.R., Smith R.J.E., Somala S., Son E.J., Sonnenberg J.A., Sorazu B., Sorrentino F., Souradeep T., Spencer A.P., Srivastava A.K., Staats K., Staley A., Steer D., Steinke M., Steinlechner J., Steinlechner S., Steinmeyer D., Stevenson S.P., Stone R., Stops D.J., Strain K.A., Stratta G., Strigin S.E., Strunk A., Sturani R., Stuver A.L., Summerscales T.Z., Sun L., Sunil S., Suresh J., Sutton P.J., Swinkels B.L., Szczepańczyk M.J., Tacca M., Tait S.C., Talbot C., Talukder D., Tanner D.B., Tápai M., Taracchini A., Tasson J.D., Taylor J.A., Taylor R., Tewari S.V., Theeg T., Thies F., Thomas E.G., Thomas M., Thomas P., Thorne K.A., Thrane E., Tiwari S., Tiwari V., Tokmakov K.V., Toland K., Tonelli M., Tornasi Z., Torres-Forné A., Torrie C.I., Töyrä D., Travasso F., Traylor G., Trinastic J., Tringali M.C., Trozzo L., Tsang K.W., Tse M., Tso R., Tsukada L., Tsuna D., Tuyenbayev D., Ueno K., Ugolini D., Unnikrishnan C.S., Urban A.L., Usman S.A., Vahlbruch H., Vajente G., Valdes G., Van Bakel N., Van Beuzekom M., Van Den Brand J.F.J., Van Den Broeck C., Vander-Hyde D.C., Van Der Schaaf L., Van Heijningen J.V., Van Veggel A.A., Vardaro M., Varma V., Vass S., Vasúth M., Vecchio A., Vedovato G., Veitch J., Veitch P.J., Venkateswara K., Venugopalan G., Verkindt D., Vetrano F., Viceré A., Viets A.D., Vinciguerra S., Vine D.J., Vinet J.-Y., Vitale S., Vo T., Vocca H., Vorvick C., Vyatchanin S.P., Wade A.R., Wade L.E., Wade M., Walet R., Walker M., Wallace L., Walsh S., Wang G., Wang H., Wang J.Z., Wang W.H., Wang Y.F., Ward R.L., Warner J., Was M., Watchi J., Weaver B., Wei L.-W., Weinert M., Weinstein A.J., Weiss R., Wen L., Wessel E.K., Weßels P., Westerweck J., Westphal T., Wette K., Whelan J.T., Whitcomb S.E., Whiting B.F., Whittle C., Wilken D., Williams D., Williams R.D., Williamson A.R., Willis J.L., Willke B., Wimmer M.H., Winkler W., Wipf C.C., Wittel H., Woan G., Woehler J., Wofford J., Wong K.W.K., Worden J., Wright J.L., Wu D.S., Wysocki D.M., Xiao S., Yamamoto H., Yancey C.C., Yang L., Yap M.J., Yazback M., Yu H., Yu H., Yvert M., Zadrozny A., Zanolin M., Zelenova T., Zendri J.-P., Zevin M., Zhang L., Zhang M., Zhang T., Zhang Y.-H., Zhao C., Zhou M., Zhou Z., Zhu S.J., Zhu X.J., Zimmerman A.B., Zucker M.E., Zweizig J., Foley R.J., Coulter D.A., Drout M.R., Kasen D., Kilpatrick C.D., Madore B.F., Murguia-Berthier A., Pan Y.-C., Piro A.L., Prochaska J.X., Ramirez-Ruiz E., Rest A., Rojas-Bravo C., Shappee B.J., Siebert M.R., Simon J.D., Ulloa N., Annis J., Soares-Santos M., Brout D., Scolnic D., Diehl H.T., Frieman J., Berger E., Alexander K.D., Allam S., Balbinot E., Blanchard P., Butler R.E., Chornock R., Cook E.R., Cowperthwaite P., Drlica-Wagner A., Drout M.R., Durret F., Eftekhari T., Finley D.A., Fong W., Fryer C.L., García-Bellido J., Gill M.S.S., Gruendl R.A., Hanna C., Hartley W., Herner K., Huterer D., Kasen D., Kessler R., Li T.S., Lin H., Lopes P.A.A., Lourenço A.C.C., Margutti R., Marriner J., Marshall J.L., Matheson T., Medina G.E., Metzger B.D., Muñoz R.R., Muir J., Nicholl M., Nugent P., Palmese A., Paz-Chinchón F., Quataert E., Sako M., Sauseda M., Schlegel D.J., Secco L.F., Smith N., Sobreira F., Stebbins A., Villar V.A., Vivas A.K., Wester W., Williams P.K.G., Yanny B., Zenteno A., Abbott T.M.C., Abdalla F.B., Bechtol K., Benoit-Lévy A., Bertin E., Bridle S.L., Brooks D., Buckley-Geer E., Burke D.L., Carnero Rosell A., Carrasco Kind M., Carretero J., Castander F.J., Cunha C.E., D'Andrea C.B., Da Costa L.N., Davis C., DePoy D.L., Desai S., Dietrich J.P., Estrada J., Fernandez E., Flaugher B., Fosalba P., Gaztanaga E., Gerdes D.W., Giannantonio T., Goldstein D.A., Gruen D., Gutierrez G., Hartley W.G., Honscheid K., Jain B., James D.J., Jeltema T., Johnson M.W.G., Kent S., Krause E., Kron R., Kuehn K., Kuhlmann S., Kuropatkin N., Lahav O., Lima M., Maia M.A.G., March M., Miller C.J., Miquel R., Neilsen E., Nord B., Ogando R.L.C., Plazas A.A., Romer A.K., Roodman A., Rykoff E.S., Sanchez E., Scarpine V., Schubnell M., Sevilla-Noarbe I., Smith M., Smith R.C., Suchyta E., Tarle G., Thomas D., Thomas R.C., Troxel M.A., Tucker D.L., Vikram V., Walker A.R., Weller J., Zhang Y., Haislip J.B., Kouprianov V.V., Reichart D.E., Tartaglia L., Sand D.J., Valenti S., Yang S., Arcavi I., Hosseinzadeh G., Howell D.A., McCully C., Poznanski D., Vasylyev S., Tanvir N.R., Levan A.J., Hjorth J., Cano Z., Copperwheat C., De Ugarte-Postigo A., Evans P.A., Fynbo J.P.U., González-Fernández C., Greiner J., Irwin M., Lyman J., Mandel I., McMahon R., Milvang-Jensen B., O'Brien P., Osborne J.P., Perley D.A., Pian E., Palazzi E., Rol E., Rosetti S., Rosswog S., Rowlinson A., Schulze S., Steeghs D.T.H., Thöne C.C., Ulaczyk K., Watson D., Wiersema K., Lipunov V.M., Gorbovskoy E., Kornilov V.G., Tyurina N., Balanutsa P., Vlasenko D., Gorbunov I., Podesta R., Levato H., Saffe C., Buckley D.A.H., Budnev N.M., Gress O., Yurkov V., Rebolo R., Serra-Ricart M.",A gravitational-wave standard siren measurement of the Hubble constant,2017,Nature,125
"Berry A.J., Danyushevsky L.V., O'Neill H.St.C., Newville M., Sutton S.R.",Oxidation state of iron in komatiitic melt inclusions indicates hot Archaean mantle,2008,Nature,125
"Long F., Su C.-C., Zimmermann M.T., Boyken S.E., Rajashankar K.R., Jernigan R.L., Yu E.W.",Crystal structures of the CusA efflux pump suggest methionine-mediated metal transport,2010,Nature,125
"Carter J.A., Fabrycky D.C., Ragozzine D., Holman M.J., Quinn S.N., Latham D.W., Buchhave L.A., Van Cleve J., Cochran W.D., Cote M.T., Endl M., Ford E.B., Haas M.R., Jenkins J.M., Koch D.G., Li J., Lissauer J.J., MacQueen P.J., Middour C.K., Orosz J.A., Rowe J.F., Steffen J.H., Welsh W.F.",KOI-126: A triply eclipsing hierarchical triple with two low-mass stars,2011,Science,126
"Tian H., Lu C., Ciais P., Michalak A.M., Canadell J.G., Saikawa E., Huntzinger D.N., Gurney K.R., Sitch S., Zhang B., Yang J., Bousquet P., Bruhwiler L., Chen G., Dlugokencky E., Friedlingstein P., Melillo J., Pan S., Poulter B., Prinn R., Saunois M., Schwalm C.R., Wofsy S.C.",The terrestrial biosphere as a net source of greenhouse gases to the atmosphere,2016,Nature,126
"Anderson T.M., Neiwert W.A., Kirk M.L., Piccoli P.M.B., Schultz A.J., Koetzle T.F., Musaev D.G., Morokuma K., Cao R., Hill C.L.","A late-transition metal oxo complex: K7Na9[O=Pt IV(H2O)L2], L = [PW9O 34]9-",2004,Science,127
"Evans J.A., Foster J.G.",Metaknowledge,2011,Science,127
"Gerber S., Jang H., Nojiri H., Matsuzawa S., Yasumura H., Bonn D.A., Liang R., Hardy W.N., Islam Z., Mehta A., Song S., Sikorski M., Stefanescu D., Feng Y., Kivelson S.A., Devereaux T.P., Shen Z.-X., Kao C.-C., Lee W.-S., Zhu D., Lee J.-S.",Three-dimensional charge density wave order in YBa2Cu3O6.67 at high magnetic fields,2015,Science,127
"Gandal M.J., Haney J.R., Parikshak N.N., Leppa V., Ramaswami G., Hartl C., Schork A.J., Appadurai V., Buil A., Werge T.M., Liu C., White K.P., Horvath S., Geschwind D.H.",Shared molecular neuropathology across major psychiatric disorders parallels polygenic overlap,2018,Science,128
"Seguin-Orlando A., Korneliussen T.S., Sikora M., Malaspinas A.-S., Manica A., Moltke I., Albrechtsen A., Ko A., Margaryan A., Moiseyev V., Goebel T., Westaway M., Lambert D., Khartanovich V., Wall J.D., Nigst P.R., Foley R.A., Lahr M.M., Nielsen R., Orlando L., Willerslev E.","Genomic structure in Europeans dating back at least 36,200 years",2014,Science,128
"Vásquez V., Sotomayor M., Cordero-Morales J., Schulten K., Perozo E.",A structural mechanism for MscS gating in lipid bilayers,2008,Science,128
"Behnke E., Collar J.I., Cooper P.S., Crum K., Crisler M., Hu M., Levine I., Nakazawa D., Nguyen H., Odom B., Ramberg E., Rasmussen J., Riley N., Sonnenschein A., Szydagis M., Tschirhart R.",Spin-dependent WIMP limits from a bubble chamber,2008,Science,129
"Irwin D.E., Bensch S., Irwin J.H., Price T.D.",Speciation by distance in a ring species,2005,Science,129
"Michailidou K., Lindström S., Dennis J., Beesley J., Hui S., Kar S., Lemaçon A., Soucy P., Glubb D., Rostamianfar A., Bolla M.K., Wang Q., Tyrer J., Dicks E., Lee A., Wang Z., Allen J., Keeman R., Eilber U., French J.D., Chen X.Q., Fachal L., McCue K., Reed A.E.M., Ghoussaini M., Carroll J.S., Jiang X., Finucane H., Adams M., Adank M.A., Ahsan H., Aittomäki K., Anton-Culver H., Antonenkova N.N., Arndt V., Aronson K.J., Arun B., Auer P.L., Bacot F., Barrdahl M., Baynes C., Beckmann M.W., Behrens S., Benitez J., Bermisheva M., Bernstein L., Blomqvist C., Bogdanova N.V., Bojesen S.E., Bonanni B., Børresen-Dale A.-L., Brand J.S., Brauch H., Brennan P., Brenner H., Brinton L., Broberg P., Brock I.W., Broeks A., Brooks-Wilson A., Brucker S.Y., Brüning T., Burwinkel B., Butterbach K., Cai Q., Cai H., Caldés T., Canzian F., Carracedo A., Carter B.D., Castelao J.E., Chan T.L., Cheng T.-Y.-D., Chia K.S., Choi J.-Y., Christiansen H., Clarke C.L., Collée M., Conroy D.M., Cordina-Duverger E., Cornelissen S., Cox D.G., Cox A., Cross S.S., Cunningham J.M., Czene K., Daly M.B., Devilee P., Doheny K.F., Dörk T., Dos-Santos-Silva I., Dumont M., Durcan L., Dwek M., Eccles D.M., Ekici A.B., Eliassen A.H., Ellberg C., Elvira M., Engel C., Eriksson M., Fasching P.A., Figueroa J., Flesch-Janys D., Fletcher O., Flyger H., Fritschi L., Gaborieau V., Gabrielson M., Gago-Dominguez M., Gao Y.-T., Gapstur S.M., García-Sáenz J.A., Gaudet M.M., Georgoulias V., Giles G.G., Glendon G., Goldberg M.S., Goldgar D.E., González-Neira A., Alnæs G.I.G., Grip M., Gronwald J., Grundy A., Guénel P., Haeberle L., Hahnen E., Haiman C.A., Håkansson N., Hamann U., Hamel N., Hankinson S., Harrington P., Hart S.N., Hartikainen J.M., Hartman M., Hein A., Heyworth J., Hicks B., Hillemanns P., Ho D.N., Hollestelle A., Hooning M.J., Hoover R.N., Hopper J.L., Hou M.-F., Hsiung C.-N., Huang G., Humphreys K., Ishiguro J., Ito H., Iwasaki M., Iwata H., Jakubowska A., Janni W., John E.M., Johnson N., Jones K., Jones M., Jukkola-Vuorinen A., Kaaks R., Kabisch M., Kaczmarek K., Kang D., Kasuga Y., Kerin M.J., Khan S., Khusnutdinova E., Kiiski J.I., Kim S.-W., Knight J.A., Kosma V.-M., Kristensen V.N., Krüger U., Kwong A., Lambrechts D., Le Marchand L., Lee E., Lee M.H., Lee J.W., Lee C.N., Lejbkowicz F., Li J., Lilyquist J., Lindblom A., Lissowska J., Lo W.-Y., Loibl S., Long J., Lophatananon A., Lubinski J., Luccarini C., Lux M.P., Ma E.S.K., MacInnis R.J., Maishman T., Makalic E., Malone K.E., Kostovska I.M., Mannermaa A., Manoukian S., Manson J.E., Margolin S., Mariapun S., Martinez M.E., Matsuo K., Mavroudis D., McKay J., McLean C., Meijers-Heijboer H., Meindl A., Menéndez P., Menon U., Meyer J., Miao H., Miller N., Taib N.A.M., Muir K., Mulligan A.M., Mulot C., Neuhausen S.L., Nevanlinna H., Neven P., Nielsen S.F., Noh D.-Y., Nordestgaard B.G., Norman A., Olopade O.I., Olson J.E., Olsson H., Olswold C., Orr N., Pankratz V.S., Park S.K., Park-Simon T.-W., Lloyd R., Perez J.I.A., Peterlongo P., Peto J., Phillips K.-A., Pinchev M., Plaseska-Karanfilska D., Prentice R., Presneau N., Prokofyeva D., Pugh E., Pylkäs K., Rack B., Radice P., Rahman N., Rennert G., Rennert H.S., Rhenius V., Romero A., Romm J., Ruddy K.J., Rüdiger T., Rudolph A., Ruebner M., Rutgers E.J.T., Saloustros E., Sandler D.P., Sangrajrang S., Sawyer E.J., Schmidt D.F., Schmutzler R.K., Schneeweiss A., Schoemaker M.J., Schumacher F., Schürmann P., Scott R.J., Scott C., Seal S., Seynaeve C., Shah M., Sharma P., Shen C.-Y., Sheng G., Sherman M.E., Shrubsole M.J., Shu X.-O., Smeets A., Sohn C., Southey M.C., Spinelli J.J., Stegmaier C., Stewart-Brown S., Stone J., Stram D.O., Surowy H., Swerdlow A., Tamimi R., Taylor J.A., Tengström M., Teo S.H., Terry M.B., Tessier D.C., Thanasitthichai S., Thöne K., Tollenaar R.A.E.M., Tomlinson I., Tong L., Torres D., Truong T., Tseng C.-C., Tsugane S., Ulmer H.-U., Ursin G., Untch M., Vachon C., Van Asperen C.J., Van Den Berg D., Van Den Ouweland A.M.W., Van Der Kolk L., Van Der Luijt R.B., Vincent D., Vollenweider J., Waisfisz Q., Wang-Gohrke S., Weinberg C.R., Wendt C., Whittemore A.S., Wildiers H., Willett W., Winqvist R., Wolk A., Wu A.H., Xia L., Yamaji T., Yang X.R., Yip C.H., Yoo K.-Y., Yu J.-C., Zheng W., Zheng Y., Zhu B., Ziogas A., Ziv E., Lakhani S.R., Antoniou A.C., Droit A., Andrulis I.L., Amos C.I., Couch F.J., Pharoah P.D.P., Chang-Claude J., Hall P., Hunter D.J., Milne R.L., García-Closas M., Schmidt M.K., Chanock S.J., Dunning A.M., Edwards S.L., Bader G.D., Chenevix-Trench G., Simard J., Kraft P., Easton D.F.",Association analysis identifies 65 new breast cancer risk loci,2017,Nature,129
"Greenberg A.J., Moran J.R., Coyne J.A., Wu C.-I.",Ecological Adaptation during Incipient Speciation Revealed by Precise Gene Replacement,2003,Science,130
"Shim S.-H., Duffy T.S., Shen G.",The post-spinel transformation in Mg2SiO4 and its relation to the 660-km seismic discontinuity,2001,Nature,130
"Abbamonte P., Blumberg G., Rusydi A., Gozar A., Evans P.G., Siegrist T., Venema L., Eisaki H., Isaacs E.D., Sawatzky G.A.",Crystallization of charge holes in the spin ladder of Sr 14Cu24O41,2004,Nature,131
"Pagani M., Caldeira K., Archer D., Zachos J.C.",An ancient carbon mystery,2006,Science,131
"Li Y.I., Van De Geijn B., Raj A., Knowles D.A., Petti A.A., Golan D., Gilad Y., Pritchard J.K.",RNA splicing is a primary link between genetic variation and disease,2016,Science,132
"Gess R.W., Coates M.I., Rubidge B.S.",A lamprey from the Devonian period of South Africa,2006,Nature,133
"Greaves G.N., Wilding M.C., Fearn S., Langstaff D., Kargl F., Cox S., Vu Van Q., Majérus O., Benmore C.J., Weber R., Martin C.M., Hennet L.",Detection of first-order liquid/liquid phase transitions in yttrium oxide-aluminum oxide melts,2008,Science,133
"Metcalf J.L., Xu Z.Z., Weiss S., Lax S., Van Treuren W., Hyde E.R., Song S.J., Amir A., Larsen P., Sangwan N., Haarmann D., Humphrey G.C., Ackermann G., Thompson L.R., Lauber C., Bibat A., Nicholas C., Gebert M.J., Petrosino J.F., Reed S.C., Gilbert J.A., Lynne A.M., Bucheli S.R., Carter D.O., Knight R.",Microbial community assembly and metabolic function during mammalian corpse decomposition,2016,Science,133
"Agarwala S., Sanders T.A., Ragsdale C.W.",Sonic hedgehog control of size and shape in midbrain pattern formation,2001,Science,134
"Kunte K., Zhang W., Tenger-Trolander A., Palmer D.H., Martin A., Reed R.D., Mullen S.P., Kronforst M.R.",Doublesex is a mimicry supergene,2014,Nature,134
