Authors,Title,Year,Source title,Cited by
"Fuchsberger C., Flannick J., Teslovich T.M., Mahajan A., Agarwala V., Gaulton K.J., Ma C., Fontanillas P., Moutsianas L., McCarthy D.J., Rivas M.A., Perry J.R.B., Sim X., Blackwell T.W., Robertson N.R., Rayner N.W., Cingolani P., Locke A.E., Tajes J.F., Highland H.M., Dupuis J., Chines P.S., Lindgren C.M., Hartl C., Jackson A.U., Chen H., Huyghe J.R., Van De Bunt M., Pearson R.D., Kumar A., Müller-Nurasyid M., Grarup N., Stringham H.M., Gamazon E.R., Lee J., Chen Y., Scott R.A., Below J.E., Chen P., Huang J., Go M.J., Stitzel M.L., Pasko D., Parker S.C.J., Varga T.V., Green T., Beer N.L., Day-Williams A.G., Ferreira T., Fingerlin T., Horikoshi M., Hu C., Huh I., Ikram M.K., Kim B.-J., Kim Y., Kim Y.J., Kwon M.-S., Lee J., Lee S., Lin K.-H., Maxwell T.J., Nagai Y., Wang X., Welch R.P., Yoon J., Zhang W., Barzilai N., Voight B.F., Han B.-G., Jenkinson C.P., Kuulasmaa T., Kuusisto J., Manning A., Ng M.C.Y., Palmer N.D., Balkau B., Stančáková A., Abboud H.E., Boeing H., Giedraitis V., Prabhakaran D., Gottesman O., Scott J., Carey J., Kwan P., Grant G., Smith J.D., Neale B.M., Purcell S., Butterworth A.S., Howson J.M.M., Lee H.M., Lu Y., Kwak S.-H., Zhao W., Danesh J., Lam V.K.L., Park K.S., Saleheen D., So W.Y., Tam C.H.T., Afzal U., Aguilar D., Arya R., Aung T., Chan E., Navarro C., Cheng C.-Y., Palli D., Correa A., Curran J.E., Rybin D., Farook V.S., Fowler S.P., Freedman B.I., Griswold M., Hale D.E., Hicks P.J., Khor C.-C., Kumar S., Lehne B., Thuillier D., Lim W.Y., Liu J., Van Der Schouw Y.T., Loh M., Musani S.K., Puppala S., Scott W.R., Yengo L., Tan S.-T., Taylor H.A., Jr., Thameem F., Wilson G., Sr., Wong T.Y., Njolstad P.R., Levy J.C., Mangino M., Bonnycastle L.L., Schwarzmayr T., Fadista J., Surdulescu G.L., Herder C., Groves C.J., Wieland T., Bork-Jensen J., Brandslund I., Christensen C., Koistinen H.A., Doney A.S.F., Kinnunen L., Esko T., Farmer A.J., Hakaste L., Hodgkiss D., Kravic J., Lyssenko V., Hollensted M., Jorgensen M.E., Jorgensen T., Ladenvall C., Justesen J.M., Käräjämäki A., Kriebel J., Rathmann W., Lannfelt L., Lauritzen T., Narisu N., Linneberg A., Melander O., Milani L., Neville M., Orho-Melander M., Qi L., Qi Q., Roden M., Rolandsson O., Swift A., Rosengren A.H., Stirrups K., Wood A.R., Mihailov E., Blancher C., Carneiro M.O., Maguire J., Poplin R., Shakir K., Fennell T., DePristo M., De Angelis M.H., Deloukas P., Gjesing A.P., Jun G., Nilsson P., Murphy J., Onofrio R., Thorand B., Hansen T., Meisinger C., Hu F.B., Isomaa B., Karpe F., Liang L., Peters A., Huth C., O'Rahilly S.P., Palmer C.N.A., Pedersen O., Rauramaa R., Tuomilehto J., Salomaa V., Watanabe R.M., Syvänen A.-C., Bergman R.N., Bharadwaj D., Bottinger E.P., Cho Y.S., Chandak G.R., Chan J.C.N., Chia K.S., Daly M.J., Ebrahim S.B., Langenberg C., Elliott P., Jablonski K.A., Lehman D.M., Jia W., Ma R.C.W., Pollin T.I., Sandhu M., Tandon N., Froguel P., Barroso I., Teo Y.Y., Zeggini E., Loos R.J.F., Small K.S., Ried J.S., DeFronzo R.A., Grallert H., Glaser B., Metspalu A., Wareham N.J., Walker M., Banks E., Gieger C., Ingelsson E., Im H.K., Illig T., Franks P.W., Buck G., Trakalo J., Buck D., Prokopenko I., Mägi R., Lind L., Farjoun Y., Owen K.R., Gloyn A.L., Strauch K., Tuomi T., Kooner J.S., Lee J.-Y., Park T., Donnelly P., Morris A.D., Hattersley A.T., Bowden D.W., Collins F.S., Atzmon G., Chambers J.C., Spector T.D., Laakso M., Strom T.M., Bell G.I., Blangero J., Duggirala R., Tai E.S., McVean G., Hanis C.L., Wilson J.G., Seielstad M., Frayling T.M., Meigs J.B., Cox N.J., Sladek R., Lander E.S., Gabriel S., Burtt N.P., Mohlke K.L., Meitinger T., Groop L., Abecasis G., Florez J.C., Scott L.J., Morris A.P., Kang H.M., Boehnke M., Altshuler D., McCarthy M.I.",The genetic architecture of type 2 diabetes,2016,Nature,367
"Talapin D.V., Shevchenko E.V., Bodnarchuk M.I., Ye X., Chen J., Murray C.B.",Quasicrystalline order in self-assembled binary nanoparticle superlattices,2009,Nature,367
"Bell G.I., Polonsky K.S.",Diabetes mellitus and genetically programmed defects in β-cell function,2001,Nature,368
"Yamashita Y.M., Mahowald A.P., Perlin J.R., Fuller M.T.",Asymmetric inheritance of mother versus daughter centrosome in stem cell division,2007,Science,368
"Flanagan J.F., Mi L.-Z., Chruszcz M., Cymborowski M., Clines K.L., Kim Y., Minor W., Rastinejad F., Khorasanizadeh S.",Double chromodomains cooperate to recognize the methylated histone H3 tail,2005,Nature,370
"Pandey A., Guyot-Sionnest P.",Slow electron cooling in colloidal quantum dots,2008,Science,370
"Carollo D., Beers T.C., Lee Y.S., Chiba M., Norris J.E., Wilhelm R., Sivarani T., Marsteller B., Munn J.A., Bailer-Jones C.A.L., Fiorentin P.R., York D.G.",Two stellar components in the halo of the Milky Way,2007,Nature,373
"Colmone A., Amorim M., Pontier A.L., Wang S., Jablonski E., Sipkins D.A.",Leukemic cells create bone marrow niches that disrupt the behavior of normal hematopoietic progenitor cells,2008,Science,374
"Squyres S.W., Arvidson R.E., Bell III J.F., Brückner J., Cabrol N.A., Calvin W., Carr M.H., Christensen P.R., Clark B.C., Crumpler L., Des Marais D.J., D'Uston C., Economou T., Farmer J., Farrand W., Folkner W., Golombek M., Gorevan S., Grant J.A., Greeley R., Grotzinger J., Haskin L., Herkenhoff K.E., Hviid S., Johnson J., Klingelhöfer G., Knoll A.H., Landis G., Lemmon M., Li R., Madsen M.B., Malin M.C., McLennan S.M., McSween H.Y., Ming D.W., Moersch J., Morris R.V., Parker T., Rice Jr. J.W., Richter L., Rieder R., Sims M., Smith M., Smith P., Soderblom L.A., Sullivan R., Wänke H., Wdowiak T., Wolff M., Yen A.","The opportunity Rover's athena science investigation at Meridiani Planum, Mars",2004,Science,379
"Melillo J.M., Reilly J.M., Kicklighter D.W., Gurgel A.C., Cronin T.W., Paltsev S., Felzer B.S., Wang X., Sokolov A.P., Adam Schlosser C.",Indirect emissions from biofuels: How important?,2009,Science,380
"Allesina S., Tang S.",Stability criteria for complex ecosystems,2012,Nature,382
"Lu J., Fu B., Kung M.C., Xiao G., Elam J.W., Kung H.H., Stair P.C.",Coking- and sintering-resistant palladium catalysts achieved through atomic layer deposition,2012,Science,384
"Townsend D., Lahankar S.A., Lee S.K., Chambreau S.D., Suits A.G., Zhang X., Rheinecker J., Harding L.B., Bowman J.M.",The roaming atom: Straying from the reaction path in formaldehyde decomposition,2004,Science,384
"Eng P.J., Trainor T.P., Brown G.E., Jr., Waychunas G.A., Newville M., Sutton S.R., Rivers M.L.",Structure of the hydrated α-Al2O3 (0001) surface,2000,Science,387
"Huang Y., Unni A.K., Thadani A.N., Rawal V.H.",Single enantiomers from a chiral-alcohol catalyst,2003,Nature,387
"Noonan J.P., Coop G., Kudaravalli S., Smith D., Krause J., Alessi J., Chen F., Platt D., Pääbo S., Pritchard J.K., Rubin E.M.",Sequencing and analysis of Neanderthal genomic DNA,2006,Science,388
"Shubin N., Tabin C., Carroll S.",Deep homology and the origins of evolutionary novelty,2009,Nature,390
"Liu Z., Otto-Bliesner B.L., He F., Brady E.C., Tomas R., Clark P.U., Carlson A.E., Lynch-Stieglitz J., Curry W., Brook E., Erickson D., Jacob R., Kutzbach J., Cheng J.",Transient simulation of last deglaciation with a new mechanism for bolling-allerod warming,2009,Science,394
"Wang C., Shim M., Guyot-Sionnest P.",Electrochromic nanocrystal quantum dots,2001,Science,394
"Alroy J., Aberhan M., Bottjer D.J., Foote M., Fürsich F.T., Harries P.J., Hendy A.J.W., Holland S.M., Ivany L.C., Kiessling W., Kosnik M.A., Marshall C.R., McGowan A.J., Miller A.I., Olszewski T.D., Patzkowsky M.E., Peters S.E., Villier L., Wagner P.J., Bonuso N., Borkow P.S., Brenneis B., Clapham M.E., Fall L.M., Ferguson C.A., Hanson V.L., Krug A.Z., Layou K.M., Leckey E.H., Nürnberg S., Powers C.M., Sessa J.A., Simpson C., Tomašových A., Visaggi C.C.",Phanerozoic trends in the global diversity of marine invertebrates,2008,Science,396
"Jung H.W., Tschaplinski T.J., Wang L., Glazebrook J., Greenberg J.T.",Priming in systemic plant immunity,2009,Science,399
"Raymond P.A., Bauer J.E.",Riverine export of aged terrestrial organic matter to the North Atlantic Ocean,2001,Nature,399
"Aguet F., Brown A.A., Castel S.E., Davis J.R., He Y., Jo B., Mohammadi P., Park Y., Parsana P., Segrè A.V., Strober B.J., Zappala Z., Cummings B.B., Gelfand E.T., Hadley K., Huang K.H., Lek M., Li X., Nedzel J.L., Nguyen D.Y., Noble M.S., Sullivan T.J., Tukiainen T., MacArthur D.G., Getz G., Addington A., Guan P., Koester S., Little A.R., Lockhart N.C., Moore H.M., Rao A., Struewing J.P., Volpi S., Brigham L.E., Hasz R., Hunter M., Johns C., Johnson M., Kopen G., Leinweber W.F., Lonsdale J.T., McDonald A., Mestichelli B., Myer K., Roe B., Salvatore M., Shad S., Thomas J.A., Walters G., Washington M., Wheeler J., Bridge J., Foster B.A., Gillard B.M., Karasik E., Kumar R., Miklos M., Moser M.T., Jewell S.D., Montroy R.G., Rohrer D.C., Valley D., Mash D.C., Davis D.A., Sobin L., Barcus M.E., Branton P.A., Abell N.S., Balliu B., Delaneau O., Frésard L., Gamazon E.R., Garrido-Martín D., Gewirtz A.D.H., Gliner G., Gloudemans M.J., Han B., He A.Z., Hormozdiari F., Li X., Liu B., Kang E.Y., McDowell I.C., Ongen H., Palowitch J.J., Peterson C.B., Quon G., Ripke S., Saha A., Shabalin A.A., Shimko T.C., Sul J.H., Teran N.A., Tsang E.K., Zhang H., Zhou Y.-H., Bustamante C.D., Cox N.J., Guigó R., Kellis M., McCarthy M.I., Conrad D.F., Eskin E., Li G., Nobel A.B., Sabatti C., Stranger B.E., Wen X., Wright F.A., Ardlie K.G., Dermitzakis E.T., Lappalainen T., Battle A., Brown C.D., Engelhardt B.E., Montgomery S.B., Handsaker R.E., Kashin S., Karczewski K.J., Nguyen D.T., Trowbridge C.A., Barshir R., Basha O., Bogu G.K., Chen L.S., Chiang C., Damani F.N., Ferreira P.G., Hall I.M., Howald C., Im H.K., Kim Y., Kim-Hellmuth S., Mangul S., Monlong J., Muñoz-Aguirre M., Ndungu A.W., Nicolae D.L., Oliva M., Panousis N., Papasaikas P., Payne A.J., Quan J., Reverter F., Sammeth M., Scott A.J., Sodaei R., Stephens M., Urbut S., Van De Bunt M., Wang G., Xi H.S., Yeger-Lotem E., Zaugg J.B., Akey J.M., Bates D., Chan J., Claussnitzer M., Demanelis K., Diegel M., Doherty J.A., Feinberg A.P., Fernando M.S., Halow J., Hansen K.D., Haugen E., Hickey P.F., Hou L., Jasmine F., Jian R., Jiang L., Johnson A., Kaul R., Kibriya M.G., Lee K., Li J.B., Li Q., Lin J., Lin S., Linder S., Linke C., Liu Y., Maurano M.T., Molinie B., Nelson J., Neri F.J., Park Y., Pierce B.L., Rinaldi N.J., Rizzardi L.F., Sandstrom R., Skol A., Smith K.S., Snyder M.P., Stamatoyannopoulos J., Tang H., Wang L., Wang M., Van Wittenberghe N., Wu F., Zhang R., Nierras C.R., Carithers L.J., Vaught J.B., Gould S.E., Lockart N.C., Martin C., Addington A.M., Koester S.E., Undale A.H., Smith A.M., Tabor D.E., Roche N.V., McLean J.A., Vatanian N., Robinson K.L., Valentino K.M., Qi L., Hunter S., Hariharan P., Singh S., Um K.S., Matose T., Tomaszewski M.M., Barker L.K., Mosavel M., Siminoff L.A., Traino H.M., Flicek P., Juettemann T., Ruffier M., Sheppard D., Taylor K., Trevanion S.J., Zerbino D.R., Craft B., Goldman M., Haeussler M., Kent W.J., Lee C.M., Paten B., Rosenbloom K.R., Vivian J., Zhu J., GTEx Consortium",Genetic effects on gene expression across human tissues,2017,Nature,403
"Wyckoff G.J., Wang W., Wu C.-I.",Rapid evolution of male reproductive genes inn the descent of man,2000,Nature,405
"Hazmanian S.K., Skaar E.P., Gaspar A.H., Humayun M., Gornicki P., Jelenska J., Joachmiak A., Missiakas D.M., Schneewind O.",Passage of heme-iron across the envelope of Staphylococcus aureus,2003,Science,407
"Ludwig M.Z., Bergman C., Patel N.H., KreLtman M.",Evidence for stabilizing selection in a eukaryotic enhancer element,2000,Nature,408
"Stahl E.A., Dwyer G., Mauricio R., Kreitman M., Bergelson J.",Dynamics of disease resistance polymorphism at the Rpm1 locus of Arabidopsis,1999,Nature,411
"Lyuksyutova A.I., Lu C.-C., Milanesio N., King L.A., Guo N., Wang Y., Nathans J., Tessier-Lavigne M., Zou Y.",Anterior-Posterior Guidance of Commissural Axons by Wnt-Frizzled Signaling,2003,Science,413
"Lissauer J.J., Fabrycky D.C., Ford E.B., Borucki W.J., Fressin F., Marcy G.W., Orosz J.A., Rowe J.F., Torres G., Welsh W.F., Batalha N.M., Bryson S.T., Buchhave L.A., Caldwell D.A., Carter J.A., Charbonneau D., Christiansen J.L., Cochran W.D., Desert J.-M., Dunham E.W., Fanelli M.N., Fortney J.J., Gautier Iii T.N., Geary J.C., Gilliland R.L., Haas M.R., Hall J.R., Holman M.J., Koch D.G., Latham D.W., Lopez E., McCauliff S., Miller N., Morehead R.C., Quintana E.V., Ragozzine D., Sasselov D., Short D.R., Steffen J.H.","A closely packed system of low-mass, low-density planets transiting Kepler-11",2011,Nature,414
"Ma J., Wollmann R., Lindquist S.",Neurotoxicity and neurodegeneration when PrP accumulates in the cytosol,2002,Science,414
"Lazaridis I., Patterson N., Mittnik A., Renaud G., Mallick S., Kirsanow K., Sudmant P.H., Schraiber J.G., Castellano S., Lipson M., Berger B., Economou C., Bollongino R., Fu Q., Bos K.I., Nordenfelt S., Li H., De Filippo C., Prüfer K., Sawyer S., Posth C., Haak W., Hallgren F., Fornander E., Rohland N., Delsate D., Francken M., Guinet J.-M., Wahl J., Ayodo G., Babiker H.A., Bailliet G., Balanovska E., Balanovsky O., Barrantes R., Bedoya G., Ben-Ami H., Bene J., Berrada F., Bravi C.M., Brisighelli F., Busby G.B.J., Cali F., Churnosov M., Cole D.E.C., Corach D., Damba L., Van Driem G., Dryomov S., Dugoujon J.-M., Fedorova S.A., Gallego Romero I., Gubina M., Hammer M., Henn B.M., Hervig T., Hodoglugil U., Jha A.R., Karachanak-Yankova S., Khusainova R., Khusnutdinova E., Kittles R., Kivisild T., Klitz W., Kučinskas V., Kushniarevich A., Laredj L., Litvinov S., Loukidis T., Mahley R.W., Melegh B., Metspalu E., Molina J., Mountain J., Näkkäläjärvi K., Nesheva D., Nyambo T., Osipova L., Parik J., Platonov F., Posukh O., Romano V., Rothhammer F., Rudan I., Ruizbakiev R., Sahakyan H., Sajantila A., Salas A., Starikovskaya E.B., Tarekegn A., Toncheva D., Turdikulova S., Uktveryte I., Utevska O., Vasquez R., Villena M., Voevoda M., Winkler C.A., Yepiskoposyan L., Zalloua P., Zemunik T., Cooper A., Capelli C., Thomas M.G., Ruiz-Linares A., Tishkoff S.A., Singh L., Thangaraj K., Villems R., Comas D., Sukernik R., Metspalu M., Meyer M., Eichler E.E., Burger J., Slatkin M., Pääbo S., Kelso J., Reich D., Krause J.",Ancient human genomes suggest three ancestral populations for present-day Europeans,2014,Nature,415
"Yu D., Wang C., Guyot-Sionnest P.",n-type conducting CdSe nanocrystal solids,2003,Science,421
"Stouffer A.L., Acharya R., Salom D., Levine A.S., Di Costanzo L., Soto C.S., Tereshko V., Nanda V., Stayrook S., DeGrado W.F.",Structural basis for the function and inhibition of an influenza virus proton channel,2008,Nature,428
"Lee K.-H., Dinner A.R., Tu C., Campi G., Raychaudhuri S., Varma R., Sims T.N., Burack W.R., Wu H., Wang J., Kanagawa O., Markiewicz M., Allen P.M., Dustin M.L., Chakraborty A.K., Shaw A.S.",The Immunological Synapse Balances T Cell Receptor Signaling and Degradation,2003,Science,430
"Mao W.L., Mao H.-K., Eng P.J., Trainor T.P., Newville M., Kao C.-C., Heinz D.L., Shu J., Meng Y., Hemley R.J.",Bonding Changes in Compressed Superhard Graphite,2003,Science,432
"Zolensky M.E., Zega T.J., Yano H., Wirick S., Westphal A.J., Weisberg M.K., Weber I., Warren J.L., Velbel M.A., Tsuchiyama A., Tsou P., Toppani A., Tomioka N., Tomeoka K., Teslich N., Taheri M., Susini J., Stroud R., Stephan T., Stadermann F.J., Snead C.J., Simon S.B., Simionovici A., See T.H., Robert F., Rietmeijer F.J.M., Rao W., Perronnet M.C., Papanastassiou D.A., Okudaira K., Ohsumi K., Ohnishi I., Nakamura-Messenger K., Nakamura T., Mostefaoui S., Mikouchi T., Meibom A., Matrajt G., Marcus M.A., Leroux H., Lemelle L., Le L., Lanzirotti A., Langenhorst F., Krot A.N., Keller L.P., Kearsley A.T., Joswiak D., Jacob D., Ishii H., Harvey R., Hagiya K., Grossman L., Grossman J.H., Graham G.A., Gounalle M., Gillet P., Genge M.J., Flynn G., Ferroir T., Fallon S., Ebel D.S., Dai Z.R., Cordier P., Clark B., Chi M., Butterworth A.L., Brownlee D.E., Bridges J.C., Brennan S., Brearley A., Bradley J.P., Bleuet P., Bland P.A., Bastien R.",Mineralogy and petrology of comet 81P/wild 2 nucleus samples,2006,Science,435
"Le Y., Mehmood F., Lee S., Greeley J., Lee B., Seifert S., Winansl R.E., Elám W., Meyer R.J., Redfern P.C., Teschner D., Schlö'Gl R., Pellin M.J., Curtiss L.A., Vajda S.",Increased silver activity for direct propylene epoxidation via subnanometer size effects,2010,Science,436
"Jablonski D., Roy K., Valentine J.W.",Out of the tropics: Evolutionary dynamics of the latitudinal diversity gradient,2006,Science,438
"Harrington M.J., Masic A., Holten-Andersen N., Waite J.H., Fratzl P.",Iron-clad fibers: A metal-based biological strategy for hard flexible coatings,2010,Science,439
"Patch A.-M., Christie E.L., Etemadmoghadam D., Garsed D.W., George J., Fereday S., Nones K., Cowin P., Alsop K., Bailey P.J., Kassahn K.S., Newell F., Quinn M.C.J., Kazakoff S., Quek K., Wilhelm-Benartzi C., Curry E., Leong H.S., Hamilton A., Mileshkin L., Au-Yeung G., Kennedy C., Hung J., Chiew Y.-E., Harnett P., Friedlander M., Quinn M., Pyman J., Cordner S., O'Brien P., Leditschke J., Young G., Strachan K., Waring P., Azar W., Mitchell C., Traficante N., Hendley J., Thorne H., Shackleton M., Miller D.K., Arnau G.M., Tothill R.W., Holloway T.P., Semple T., Harliwong I., Nourse C., Nourbakhsh E., Manning S., Idrisoglu S., Bruxner T.J.C., Christ A.N., Poudel B., Holmes O., Anderson M., Leonard C., Lonie A., Hall N., Wood S., Taylor D.F., Xu Q., Lynn Fink J., Waddell N., Drapkin R., Stronach E., Gabra H., Brown R., Jewell A., Nagaraj S.H., Markham E., Wilson P.J., Ellul J., McNally O., Doyle M.A., Vedururu R., Stewart C., Lengyel E., Pearson J.V., Waddell N., Defazio A., Grimmond S.M., Bowtell D.D.L.",Whole-genome characterization of chemoresistant ovarian cancer,2015,Nature,442
"Ma Y., Eremets M., Oganov A.R., Xie Y., Trojan I., Medvedev S., Lyakhov A.O., Valle M., Prakapenka V.",Transparent dense sodium,2009,Nature,446
"Kovac J.M., Leitch E.M., Pryke C., Carlstrom J.E., Halverson N.W., Holzapfel W.L.",Detection of polarization in the cosmic microwave background using DASI,2002,Nature,448
"Schimel D., Melillo J., Tian H., McGuire A.D., Kicklighter D., Kittel T., Rosenbloom N., Running S., Thornton P., Ojima D., Parton W., Kelly R., Sykes M., Neilson R., Rizzo B.",Contribution of increasing CO 2 and climate to carbon storage by ecosystems in the United States,2000,Science,449
"Lee J.H., Fang L., Vlahos E., Ke X., Jung Y.W., Kourkoutis L.F., Kim J.-W., Ryan P.J., Heeg T., Roeckerath M., Goian V., Bernhagen M., Uecker R., Hammel P.C., Rabe K.M., Kamba S., Schubert J., Freeland J.W., Muller D.A., Fennie C.J., Schiffer P., Gopalan V., Johnston-Halperin E., Schlom D.G.",A strong ferroelectric ferromagnet created by means of spin-lattice coupling,2010,Nature,450
"Doeleman S.S., Weintroub J., Rogers A.E.E., Plambeck R., Freund R., Tilanus R.P.J., Friberg P., Ziurys L.M., Moran J.M., Corey B., Young K.H., Smythe D.L., Titus M., Marrone D.P., Cappallo R.J., Bock D.C.-J., Bower G.C., Chamberlin R., Davis G.R., Krichbaum T.P., Lamb J., Maness H., Niell A.E., Roy A., Strittmatter P., Werthimer D., Whitney A.R., Woody D.",Event-horizon-scale structure in the supermassive black hole candidate at the Galactic Centre,2008,Nature,454
"Jiang W., Upadhyaya P., Zhang W., Yu G., Jungfleisch M.B., Fradin F.Y., Pearson J.E., Tserkovnyak Y., Wang K.L., Heinonen O., Te Velthuis S.G.E., Hoffmann A.",Blowing magnetic skyrmion bubbles,2015,Science,455
"Keimer B., Kivelson S.A., Norman M.R., Uchida S., Zaanen J.",From quantum matter to high-temperature superconductivity in copper oxides,2015,Nature,455
"Tian D., Traw M.B., Chen J.Q., Kreitman M., Bergelson J.",Fitness costs of R-gene-mediated resistance in Arabidopsis thaliana,2003,Nature,459
"Christianson A.D., Goremychkin E.A., Osborn R., Rosenkranz S., Lumsden M.D., Malliakas C.D., Todorov I.S., Claus H., Chung D.Y., Kanatzidis M.G., Bewley R.I., Guidi T.",Unconventional superconductivity in Ba0.6K0.4Fe 2As2 from inelastic neutron scattering,2008,Nature,464
"Bedard P.L., Hansen A.R., Ratain M.J., Siu L.L.",Tumour heterogeneity in the clinic,2013,Nature,470
"True H.L., Lindquist S.L.",A yeast prion provides a mechanism for genetic variation and phenotypic diversity,2000,Nature,481
"Michel F.M., Ehm L., Antao S.M., Lee P.L., Chupas P.J., Liu G., Strongin D.R., Schoonen M.A.A., Phillips B.L., Parise J.B.","The structure of ferrihydrite, a nanocrystalline material",2007,Science,482
"Reddy K.L., Zullo J.M., Bertolino E., Singh H.",Transcriptional repression mediated by repositioning of genes to the nuclear lamina,2008,Nature,482
"Morrison H.G., McArthur A.G., Gillin F.D., Aley S.B., Adam R.D., Olsen G.J., Best A.A., Cande W.Z., Chen F., Cipriano M.J., Davids B.J., Dawson S.C., Elmendorf H.G., Hehl A.B., Holder M.E., Huse S.M., Kim U.U., Lasek-Nesselquist E., Manning G., Nigam A., Nixon J.E.J., Palm D., Passamaneck N.E., Prabhu A., Reich C.I., Reiner D.S., Samuelson J., Svard S.G., Sogin M.L.",Genomic minimalism in the early diverging intestinal parasite Giardia lamblia,2007,Science,484
"Fukuchi-Shimogori T., Grove E.A.",Neocortex patterning by the secreted signaling molecute FGF8,2001,Science,485
"Celniker S.E., Dillon L.A.L., Gerstein M.B., Gunsalus K.C., Henikoff S., Karpen G.H., Kellis M., Lai E.C., Lieb J.D., MacAlpine D.M., Micklem G., Piano F., Snyder M., Stein L., White K.P., Waterston R.H.",Unlocking the secrets of the genome,2009,Nature,488
"Ahart M., Somayazulu M., Cohen R.E., Ganesh P., Dera P., Mao H.-K., Hemley R.J., Ren Y., Liermann P., Wu Z.",Origin of morphotropic phase boundaries in ferroelectrics,2008,Nature,490
"Chu J.-H., Analytis J.G., De Greve K., McMahon P.L., Islam Z., Yamamoto Y., Fisher I.R.",In-plane resistivity anisotropy in an underdoped iron arsenide superconductor,2010,Science,490
"Rowley D.B., Currie B.S.","Palaeo-altimetry of the late Eocene to Miocene Lunpola basin, central Tibet",2006,Nature,490
"Young L., Kanter E.P., Kräsignssig B., Li Y., March A.M., Pratt S.T., Santra R., Southworth S.H., Rohringer N., Dimauro L.F., Doumy G., Roedig C.A., Berrah N., Fang L., Hoener M., Bucksbaum P.H., Cryan J.P., Ghimire S., Glownia J.M., Reis D.A., Bozek J.D., Bostedt C., Messerschmidt M.",Femtosecond electronic response of atoms to ultra-intense X-rays,2010,Nature,498
"Bode M., Heide M., Von Bergmann K., Ferriani P., Heinze S., Bihlmayer G., Kubetzka A., Pietzsch O., Blügel S., Wiesendanger R.",Chiral magnetic order at surfaces driven by inversion asymmetry,2007,Nature,501
"Zheng J., Birktoft J.J., Chen Y., Wang T., Sha R., Constantinou P.E., Ginell S.L., Mao C., Seeman N.C.",From molecular to macroscopic via the rational design of a self-assembled 3D DNA crystal,2009,Nature,503
"Ozyuzer L., Koshelev A.E., Kurter C., Gopalsami N., Li Q., Tachiki M., Kadowaki K., Yamamoto T., Minami H., Yamaguchi H., Tachiki T., Gray K.E., Kwok W.-K., Welp U.",Emission of coherent THz radiation from superconductors,2007,Science,504
